,text,time,len,len_stop,tfidf,sim_p,sim_pp,sim_n,sim_nn,goal,score,won,win,lose,lost,draw,penalty,position,breakthrough,header,offside
229,Huge chance for Bournemouth to surely seal the win!,82 min,7,3,33.3690980128,0.354049208593,0.0245980315237,0.036797733139,0.0133044084333,0,0.1,0,1,0,0,0,0,0,0,0,0
230,"It is a lovely move as Wilson plays a clever first-time pass in to Gosling, who suddenly finds himself in space with only the keeper to beat.",82 min,15,14,96.9878436674,0.036797733139,0.0,0.00731618843123,0.0,0,0.14536,0,0,0,0,0,0,0,0,0,0
231,"However, he curls his effort just past the top corner.",82 min,8,4,40.2554014869,0.00731618843123,0.0133044084333,0.0,0.0,0,0.159265,0,0,0,0,0,0,0,0,0,0
232,RED CARD!,82 min,3,0,9.39018142823,0.0,0.0,0.0,0.0,0,0.0677,0,0,0,0,0,0,0,0,0,0
233,Simon Francis (Bournemouth),82 min,5,0,12.4583289633,0.0,0.0,0.0878002261702,0.136006546286,0,0.06083,0,0,0,0,0,0,0,0,0,0
234,Big trouble for Bournemouth now!,82 min,4,2,18.9839841739,0.0878002261702,0.0,0.0292856065232,0.0318784220132,0,0.04348,0,0,0,0,0,0,0,0,0,0
235,They will have to see this game out with only 10 men as Francis is shown a straight red card for a heavy challenge on Ramsey.,82 min,13,14,93.5570533679,0.0292856065232,0.136006546286,0.0531990907888,0.103657002383,0,0.439975,0,0,0,0,0,0,0,0,0,0
236,"He was a little high and followed through with his trailing leg, but that is a borderline one for me.",82 min,9,13,73.42803076,0.0531990907888,0.0318784220132,0.0719862931502,0.0630295584027,0,0.15314,0,0,0,0,0,0,0,0,0,0
237,"It wasn't particularly reckless, but Oliver was in no doubt about the red card and the referee has got everything else right tonight.",82 min,15,11,94.5152540191,0.0719862931502,0.103657002383,0.0,0.0161998770573,0,0.09524,0,0,0,0,0,0,0,0,0,0
238,Can Bournemouth see this one out now.,84 min,4,4,25.5473318651,0.0,0.0630295584027,0.0,0.0,0,0.06,0,0,0,0,0,0,0,0,0,0
239,Suddenly it looks like a big ask when just 15 minutes ago they seemed nailed on for a famous three points.,84 min,14,8,81.790913931,0.0,0.0161998770573,0.0,0.0163592651061,0,0.127955,0,0,0,0,0,0,0,0,0,0
240,SHOT!,86 min,2,0,4.03347260154,0.0,0.0,0.0,0.0,0,0.025,0,0,0,0,0,0,0,0,0,0
241,"Chance for Arsenal to get the equaliser as the ball is lifted in to Ramsey, who tries a first-time volley.",86 min,12,10,60.6135622027,0.0,0.0163592651061,0.0511978928781,0.0818552043325,0,0.16221,0,0,0,0,0,0,0,0,0,0
242,"It is a difficult one, though, and he doesn't catch it right as it goes wide.",86 min,11,9,54.4988322816,0.0511978928781,0.0,0.0824280057422,0.0950101635732,0,0.086205,0,0,0,0,0,0,0,0,0,0
243,"Arsenal are piling the pressure on now, and I suspect it will be this way until the full-time whistle now.",88 min,9,13,65.1265150847,0.0824280057422,0.0818552043325,0.224462446512,0.0413830831953,0,0.109875,0,0,0,0,0,0,0,0,0,0
244,Bournemouth may not see much of it inside the Arsenal half from now on.,88 min,8,7,47.0065885218,0.224462446512,0.0950101635732,0.0926604659746,0.0281682886351,0,0.17589,0,0,0,0,0,0,0,0,0,0
245,BOURNEMOUTH SUB: A third and final change for Bournemouth sees Brad Smith come on for Wilson.,90 min,13,5,58.8843713698,0.0926604659746,0.0413830831953,0.0,0.0992226048442,0,0.10988,0,0,0,0,0,0,0,0,0,0
246,The fourth official then switches his board to show SIX minutes of stoppage time!,90+1 min,10,5,59.2781392566,0.0,0.0281682886351,0.102139706915,0.0,0,0.121305,0,0,0,0,0,0,0,0,0,0
247,Still time for Arsenal!,90+1 min,4,1,12.2285209067,0.102139706915,0.0992226048442,0.0,0.113810813883,0,0.058825,0,0,0,0,0,0,0,0,0,0
248,GOAL!,90+2 min,2,0,3.1326860562,0.0,0.0,0.0,0.0,1,0.02941,0,0,0,0,0,0,0,0,0,0
249,Bournemouth 3-3 Arsenal (Olivier Giroud),90+2 min,7,0,14.2344552573,0.0,0.113810813883,0.0872832791976,0.103990147863,0,0.09881,0,0,0,0,0,0,0,0,0,0
250,Comeback complete from Arsenal!,90+2 min,4,1,15.5728101561,0.0872832791976,0.0,0.0459553497857,0.0,0,0.07692,0,0,0,0,0,0,0,0,0,0
251,"They rescue a point from the jaws of defeat and, having claimed two assists already, Giroud has his own name on the scoresheet.",90+2 min,14,12,87.3573640649,0.0459553497857,0.103990147863,0.0976072795464,0.0200646600005,0,0.157895,0,0,0,0,0,0,0,0,0,0
252,Xhaka lifts the ball into the box and Giroud glances a header into the bottom corner.,90+2 min,10,7,56.3881539774,0.0976072795464,0.0,0.0357117298799,0.0,0,0.2523,0,0,0,0,0,0,0,0,1,0
253,Incredible scenes at the Vitality Stadium!,90+2 min,5,2,24.6610606304,0.0357117298799,0.0200646600005,0.0,0.186514906491,0,0.1343,0,0,0,0,0,0,0,0,0,0
254,CHANCE!,90+4 min,2,0,4.295836866,0.0,0.0,0.0,0.0,0,0.02381,0,0,0,0,0,0,0,0,0,0
255,Bournemouth are suddenly pushing for a winner here in this incredible game!,90+4 min,7,6,42.4513849754,0.0,0.186514906491,0.0,0.0669432538208,0,0.08511,0,1,0,0,0,0,0,0,0,0
256,"They get into the box on the right channel and Arter powers one towards goal from a tight angle, but Cech does well to push it away.",90+4 min,17,12,96.8919011284,0.0,0.0,0.0,0.0,1,0.18698,0,0,0,0,0,0,0,0,0,0
257,FULL TIME: Bournemouth 3-3 Arsenal,90+6 min,6,0,12.5968464679,0.0,0.0669432538208,0.0,0.0,0,0.05263,0,0,0,0,0,0,0,0,0,0
258,Wow.,9.58pm,2,0,5.90527477844,0.0,0.0,0.0,0.0,0,0.0,0,0,0,0,0,0,0,0,0,0
259,What a match that was.,9.58pm,2,4,15.2576400223,0.0,0.0,0.0,0.0,0,0.074995,0,0,0,0,0,0,0,0,0,0
260,"Before the game Bournemouth will have taken a draw I'm sure, but right now it must feel like a defeat for the hosts and a big, big victory for Arsenal.",9.58pm,19,15,96.3337898829,0.0,0.0,0.0365038902872,0.0170046782715,0,0.279855,0,0,0,0,1,0,0,0,0,0
261,"The Gunners seemed dead and buried following a lacklustre performance in the opening 70 minutes, with goals from Daniels, Wilson and Fraser leaving them three behind.",9.58pm,20,9,99.712654885,0.0365038902872,0.0,0.0704023791829,0.0559482394546,1,0.23848,0,1,0,0,0,0,0,0,0,0
262,"However, Sanchez gave them hope with a 70th-minute diving head, and a stunning Lucas Perez volley then turned the possibility of a dramatic comeback into a likelihood.",9.58pm,19,11,97.1960618147,0.0704023791829,0.0170046782715,0.0863251103447,0.0,0,0.191,0,0,0,0,0,0,0,0,0,0
263,"A red card for Simon Francis helped the visitors further, and Giroud finally sealed the memorable fightback in the second minute of injury time.",9.58pm,17,9,92.6848203487,0.0863251103447,0.0559482394546,0.0,0.0766481013532,0,0.17781,0,0,0,0,0,0,0,0,0,0
264,Brilliant entertainment.,9.58pm,3,0,11.1174023763,0.0,0.0,0.0,0.0,0,0.0,0,0,0,0,0,0,0,0,0,0
265,"Right, that is all we have time for tonight!",10pm,5,6,29.3651287387,0.0,0.0766481013532,0.039965982778,0.0407083638576,0,0.070175,0,0,0,0,0,0,0,0,0,0
266,Thank you very much for joining Sports Mole for this six-goal thriller as Arsenal come from three goals down in the final 20 minutes to draw 3-3 in one of the great Premier League comebacks in recent memory.,10pm,24,15,139.908473844,0.039965982778,0.0,0.106488355969,0.0633782716641,1,0.31332,0,0,0,0,1,0,0,0,0,0
267,I will leave you with our match report - well worth a read for a recap of the madcap events here at the Vitality Stadium - and be sure to stick around for reaction from both camps too.,10pm,19,20,137.56942266,0.106488355969,0.0407083638576,0.0645555435956,0.0,0,0.169565,0,0,0,0,0,0,0,0,0,0
268,"From me, though, it is goodbye for now!",10pm,5,6,28.8122665433,0.0645555435956,0.0633782716641,0.0,0.0,0,0.07143,0,0,0,0,0,0,0,0,0,0
