,text,time,len,len_stop,tfidf,sim_p,sim_pp,sim_n,sim_nn,goal,score,won,win,lose,lost,draw,penalty,position,breakthrough,header,offside
219,"Just the three minutes of added time added on at San Mames, of which we have played two of them.",90+2 min,11,11,66.4347915315,0.445730622092,0.0198962105552,0.153813299685,0.0780098413437,0,0.15373,0,0,0,0,0,0,0,0,0,0
220,"Barcelona have a two-man advantage in these final throes, but the ball just will not fall nicely to them in a packed Bilbao box.",90+2 min,13,13,75.4482432977,0.153813299685,0.0,0.0992878236761,0.0805799724117,0,0.229985,0,0,0,0,0,0,0,0,0,0
221,FULL TIME: ATHLETIC BILBAO 2-1 BARCELONA,90+4 min,7,0,16.750673098,0.0992878236761,0.0780098413437,0.0603836722404,0.17057619371,0,0.133555,0,0,0,0,0,0,0,0,0,0
222,"Absolutely incredible scenes at San Mames, as Pique back-heels the ball to an unmarked Messi in the fourth minute of added time, but he can only fire it against the post.",10.09pm,19,15,110.3441874,0.0603836722404,0.0805799724117,0.101775073232,0.0865392661538,0,0.15107,0,0,0,0,0,0,0,0,0,0
223,"That sums up his night; it sums up Barcelona's night, too, as they failed to break down the nine men of Athletic Bilbao and now have work to do in six days' time in the return leg at Camp Nou.",10.09pm,25,21,144.699104081,0.101775073232,0.17057619371,0.0285179176479,0.0520346654536,0,0.29512,0,0,0,0,0,0,0,0,0,0
224,Can't wait for that one!,10.09pm,5,2,14.2447791703,0.0285179176479,0.0865392661538,0.0345924372121,0.0358298070804,0,0.05556,0,0,0,0,0,0,0,0,0,0
225,"That concludes Sports Mole's live text coverage of events in the Basque Country, but be sure to check out this on-the-whistle report before heading off.",10.11pm,17,11,100.007978265,0.0345924372121,0.0520346654536,0.0195064508822,0.0,0,0.15534,0,0,0,0,0,0,0,0,0,0
226,"We will have more Copa del Rey action for you next week in the return legs, so join us then!",10.11pm,12,10,78.0500004376,0.0195064508822,0.0358298070804,0.0,0.0,0,0.168085,0,0,0,0,0,0,0,0,0,0
