,sentences,pos,len,len_stop,tfidf,sim_p,sim_pp,sim_n,sim_nn,century,out,bold,caught,stumped,wicket,hattrick,catch,six,four,amazing,hundred,ton,boundary,drop,toss,won,lost,score
684,"Raina to Williamson, no run, tossed up outside off, Williamson went too hard on the cover drive and lost all timing on the shot, finds coverSuresh Raina, right-arm off break, comes into the attack .",274,27,14,133.647011583,0.183577722409,0.158051095965,0.139531259174,0.224100220945,0,1,0,0,0,0,0,0,0,0,0,0,0,0,0,1,0,1,0.132825
685,"Bumrah to Corey Anderson, no run, slanted across off on a good length, Anderson moves slightly forward and across and taps it to cover .",273,19,9,90.6116348742,0.139531259174,0.0386593019052,0.199069071671,0.124270932652,0,0,0,0,0,0,0,0,0,0,0,0,0,0,0,0,0,0,0.13846
686,"Bumrah to Williamson, 1 run, back of a length delivery just outside off, Williamson stays flat-footed and pushes it in front of cover .",272,18,9,75.1221557238,0.199069071671,0.224100220945,0.204771101158,0.0335254817338,0,1,0,0,0,0,0,0,0,0,0,0,0,0,0,0,0,0,0.115385
687,"Bumrah to Williamson, no run, yes keep doing that, and you'll be back in the dressing room in no time.",271,14,11,78.9137481909,0.204771101158,0.124270932652,0.0335771216664,0.186754823088,0,0,0,0,0,0,0,0,0,0,0,0,0,0,0,0,0,0,0.18087
688,"Patted to Jadeja at backward point, Anderson is already halfway down looking for a single, rightly sent back and a direct hit would have seen him short despite a dive .",270,22,11,131.747785195,0.0335771216664,0.0335254817338,0.00710309269676,0.00753642140888,0,0,0,0,0,0,0,0,0,0,0,0,0,0,0,0,0,0,0.08995
689,"Bumrah to Williamson, no run, NZ just can't stop playing shots.",269,12,3,45.3914094016,0.00710309269676,0.186754823088,0.012551881104,0.0759602515828,0,0,0,0,0,0,0,0,0,0,0,0,0,0,0,0,0,0,0.07547
690,It's like a garage sale - everything has to go.,268,8,4,39.8956125639,0.012551881104,0.00753642140888,0.0805942553042,0.0,0,0,0,0,0,0,0,0,0,0,0,0,0,0,0,0,0,0,0.105265
691,"Williamson walks across the stumps in position to scoop, has the right length to execute but fails to connect.",267,13,8,80.4841392774,0.0805942553042,0.0759602515828,0.0295006187876,0.171874329378,0,0,0,0,0,0,0,0,0,0,0,0,0,0,0,0,0,0,0.11628
692,Hit on the pad outside off .,266,4,3,21.3195075699,0.0295006187876,0.0,0.144751778132,0.11446327453,0,1,0,0,0,0,0,0,0,0,0,0,0,0,0,0,0,0,0.136365
693,"Bumrah to Williamson, no run, back of a length outside off, Williamson punches and finds backward point .",265,15,6,60.1217072647,0.144751778132,0.171874329378,0.380602046935,0.121714646494,0,1,0,0,0,0,0,0,0,0,0,0,0,0,0,0,0,0,0.114285
694,"Bumrah to Williamson, no run, short of length around off, wristed off the back foot to mid-onJasprit Bumrah, right-arm medium, comes into the attack .",264,21,9,82.857935222,0.380602046935,0.11446327453,0.13343665253,0.0,0,0,0,0,0,0,0,0,0,0,0,0,0,0,0,0,0,0,0.14067
695,"Ashwin to Corey Anderson, FOUR, Ashwin comes over the wicket for the final delivery and pitches it outside leg, Corey Anderson powers the sweep, Bumrah at deep backward square leg looked to have it covered, but the timing on the shot beat him.",263,32,17,168.381422709,0.13343665253,0.121714646494,0.0302186235514,0.0487746296948,0,1,0,0,0,1,0,0,0,1,0,0,0,0,0,0,0,0,0.147035
696,He should've dived but didn't.,262,4,4,25.3306534485,0.0302186235514,0.0,0.0,0.0,0,0,0,0,0,0,0,0,0,0,0,0,0,0,0,0,0,0,0.063405
697,That allowed the boundary .,261,3,2,17.1751887207,0.0,0.0487746296948,0.0260747740574,0.0501726114138,0,0,0,0,0,0,0,0,0,0,0,0,0,1,0,0,0,0,0.083335
698,"Ashwin to Williamson, 1 run, turned to Rohit at backward square leg, quick single taken and Williamson's bat gets in the way of the throw of Rohit.",260,23,9,99.096617998,0.0260747740574,0.0,0.231173974571,0.0,0,0,0,0,0,0,0,0,0,0,0,0,0,0,0,0,0,0,0.133335
699,Williamson stretched out and the ball hit the bat.,259,6,4,31.9160523464,0.231173974571,0.0501726114138,0.0,0.115447670088,0,1,0,0,0,0,0,0,0,0,0,0,0,0,0,0,0,0,0.16348
700,Nothing intentional about that.,258,3,2,21.9082863914,0.0,0.0,0.0,0.0,0,1,0,0,0,0,0,0,0,0,0,0,0,0,0,0,0,0,0.01923
701,"Had it not been for the bat, would've been close and Rohit knows it.",257,8,9,56.253757133,0.0,0.115447670088,0.0,0.0,0,0,0,0,0,0,0,0,0,0,0,0,0,0,0,0,0,0,0.10345
702,Jumps in despair .,256,3,1,16.7338665689,0.0,0.0,0.0,0.0,0,0,0,0,0,0,0,0,0,0,0,0,0,0,0,0,0,0,0.09091
703,"Ashwin to Williamson, no run, Williamson misses out on four.",255,9,4,35.7994050884,0.0,0.0,0.0,0.157928198974,0,1,0,0,0,0,0,0,0,1,0,0,0,0,0,0,0,0,0.07143
704,"Short and down leg, rocks back and pulls, finds the diving Rohit Sharma inside the ring at backward square leg.",254,17,6,88.407140159,0.0,0.0,0.0368094646875,0.168343453464,0,0,0,0,0,0,0,0,0,0,0,0,0,0,0,0,0,0,0.13304
705,Either side and it was four .,253,4,3,24.1468845653,0.0368094646875,0.157928198974,0.0,0.107414353722,0,0,0,0,0,0,0,0,0,1,0,0,0,0,0,0,0,0,0.134505
706,"Ashwin to Corey Anderson, 1 run, short down leg, Corey Anderson pumps the pull to deep mid-wicket, straight to the fielder, so only a single .",252,22,9,82.5875040824,0.0,0.168343453464,0.281988138801,0.0,0,0,0,0,0,1,0,0,0,0,0,0,0,0,0,0,0,0,0.111825
707,"Ashwin to Corey Anderson, FOUR, for a moment Corey Anderson must have felt he had holed out.",251,13,7,68.4505188641,0.281988138801,0.107414353722,0.0388529684217,0.157195111597,0,1,0,0,0,0,0,0,0,1,0,0,0,0,0,0,0,0,0.114285
708,Nervy little second for him.,250,4,2,25.4979424679,0.0388529684217,0.0,0.0250261789958,0.0,0,0,0,0,0,0,0,0,0,0,0,0,0,0,0,0,0,0,0.05263
709,"Used his feet and the ball was cleverly pitched outside leg with lots of flight, deceived Corey Anderson completely, somehow he flicked and the leading edge goes in no-man's land and runs away for four at deep mid-wicket .",249,29,13,160.038381409,0.0250261789958,0.157195111597,0.251953078052,0.0455015663925,0,1,0,0,0,1,0,0,0,1,0,0,0,0,0,0,0,0,0.118645
710,"Ashwin to Corey Anderson, no run, Corey Anderson uses his feet and then gently turns it to short mid-wicket .",248,15,7,67.9913567944,0.251953078052,0.0,0.0194749732176,0.0269345330645,0,0,0,0,0,1,0,0,0,0,0,0,0,0,0,0,0,0,0.096155
711,"Nehra to Williamson, FOUR, that is a high class stroke from Williamson.",247,10,5,47.1337663147,0.0194749732176,0.0455015663925,0.02564589611,0.00798182513167,0,0,0,0,0,0,0,0,0,1,0,0,0,0,0,0,0,0,0.06818
712,"On a slow pitch, other lesser mortals might have gone too hard on that and mistimed it.",246,10,9,77.140153398,0.02564589611,0.0269345330645,0.0308272466191,0.0169776090893,0,0,0,0,0,0,0,0,0,0,0,0,0,0,0,0,0,0,0.076925
713,"Instead he waits for the ball to arrive and once it does, delays the cut, finds the gap and beats a diving short cover.",245,15,12,101.277251754,0.0308272466191,0.00798182513167,0.0299387706903,0.0836726958158,0,0,0,0,0,0,0,0,0,0,0,0,0,0,0,0,0,0,0.14886
714,Well wide of mid-off and raced away.,244,6,2,25.5366656789,0.0299387706903,0.0169776090893,0.0227415025209,0.0587701598121,0,0,0,0,0,0,0,0,0,0,0,0,0,0,0,0,0,0,0.105265
715,The key was he timed that and that gave him four.,243,5,7,45.8297373781,0.0227415025209,0.0836726958158,0.0,0.167736163117,0,0,0,0,0,0,0,0,0,1,0,0,0,0,0,0,0,0,0.13793
716,Class of Williamson on display .,242,4,2,23.2284227292,0.0,0.0587701598121,0.108830572102,0.167122882181,0,0,0,0,0,0,0,0,0,0,0,0,0,0,0,0,0,0,0.09091
717,"Nehra to Williamson, no run, and he finds that man to perfection.",241,9,6,42.5626767034,0.108830572102,0.167736163117,0.220470523786,0.0536189603155,0,0,0,0,0,0,0,0,0,0,0,0,0,0,0,0,0,0,0.1
718,"On a back of a length outside off, Williamson dabs and Raina runs to his right to fieldA wide gully in place for Williamson's late dabs to third man.",240,20,12,112.224189667,0.220470523786,0.167122882181,0.0,0.033948648393,0,1,0,0,0,0,0,0,0,0,0,0,0,0,0,0,0,0,0.129035
719,Very good field placing that .,239,4,2,25.6614570278,0.0,0.0536189603155,0.0,0.0,0,0,0,0,0,0,0,0,0,0,0,0,0,0,0,0,0,0,0.076925
720,"Nehra to Corey Anderson, 1 run, nipping in towards the pads, Corey Anderson gets a faint inside edge onto the pad on the flick, the ball rolls towards short mid-wicket, an easy single taken .",238,31,9,130.841163677,0.0,0.033948648393,0.322709992078,0.247521512591,0,0,0,0,0,1,0,0,0,0,0,0,0,0,0,0,0,0,0.170205
721,"Nehra to Corey Anderson, no run, again it stops on Corey Anderson, who was lining up for the big stroke through the line, since the length wasn't there, Corey Anderson finds mid-offSlip taken off .",237,25,16,128.364456034,0.322709992078,0.0,0.38061042544,0.365339362819,0,0,0,0,0,0,0,0,0,0,0,0,0,0,0,0,0,0,0.13333
722,"Nehra to Corey Anderson, no run, full and a hint of shape inwards for Nehra, targetting off, Corey Anderson's bat face closes on the drive, finds Rohit at mid-on .",236,26,10,112.744996295,0.38061042544,0.247521512591,0.38251775221,0.210300504927,0,0,0,0,0,0,0,0,0,0,0,0,0,0,0,0,0,0,0.126915
723,"Nehra to Corey Anderson, no run, Nehra is lucky there.",235,9,4,36.400405456,0.38251775221,0.365339362819,0.0891615243153,0.0,0,0,0,0,0,0,0,0,0,0,0,0,0,0,0,0,0,0,0.106005
724,"Drifting on the pads, Corey Anderson failed to get any bat on the flick, off the pad and Mahendra Singh Dhoni collects.",234,16,9,91.6091388239,0.0891615243153,0.210300504927,0.0139569855037,0.180493295525,0,0,0,0,0,0,0,0,0,0,0,0,0,0,0,0,0,0,0.227635
725,A faint glance and it would've been four .,233,6,4,32.4179045979,0.0139569855037,0.0,0.0134001469677,0.0356953139413,0,0,0,0,0,0,0,0,0,1,0,0,0,0,0,0,0,0,0.12317
726,"Ashwin to Corey Anderson, 1 run, on off stump, Corey Anderson kneels down and then gently paddles that around the corner for a single to keep strike .",232,20,11,100.627691145,0.0134001469677,0.180493295525,0.174784772537,0.115761421955,0,0,0,0,0,0,0,0,0,0,0,0,0,0,0,0,0,0,0.156585
727,"Ashwin to Williamson, 1 run, this is pulled back a touch, the ball stops on Williamson who goes back and pushes it to long-on for a single .",231,19,12,86.211717244,0.174784772537,0.0356953139413,0.263104849596,0.239070898481,0,0,0,0,0,0,0,0,0,0,0,0,0,0,0,0,0,0,0.150575
728,"Ashwin to Williamson, no run, tossed up outside off, Williamson gets forward and flicks to mid-wicket with the spin .",230,15,8,65.1886216315,0.263104849596,0.115761421955,0.118119608106,0.273663571548,0,1,0,0,0,1,0,0,0,0,0,0,0,0,0,1,0,0,0.163705
729,"Ashwin to Corey Anderson, 1 run, fired in on the stumps, whipped wristily to long-on .",229,14,5,47.5919204343,0.118119608106,0.239070898481,0.262570177754,0.030892043823,0,0,0,0,0,0,0,0,0,0,0,0,0,0,0,0,0,0,0.117645
730,"Ashwin to Corey Anderson, no run, teasing line and loop from Ashwin, Corey Anderson gets forward and then gently pushes it back to the bowler.",228,20,9,94.7258836178,0.262570177754,0.273663571548,0.104107269367,0.441605692467,0,0,0,0,0,0,0,0,0,0,0,0,0,0,0,0,0,0,0.108695
731,For a moment he wanted to go for the big hit and then restrained himself .,227,7,9,60.2796307453,0.104107269367,0.030892043823,0.0499466851508,0.0,0,0,0,0,0,0,0,0,0,0,0,0,0,0,0,0,0,0,0.172105
732,"Ashwin to Corey Anderson, no run, on the middle and leg line, nicely flighted too, gently turned to short mid-wicketAshwin to continue, from round the wicket to Corey Anderson.",226,24,11,104.643587451,0.0499466851508,0.441605692467,0.0,0.105842107172,0,0,0,0,0,1,0,0,0,0,0,0,0,0,0,0,0,0,0.09859
733,With a slip in place .,225,3,3,19.3590528383,0.0,0.0,0.0,0.0,0,0,0,0,0,0,0,0,0,0,0,0,0,0,0,0,0,0,0.086955
734,"Nehra to Williamson, no run, Williamson sinks to his haunches after mistiming a cut to backward point.",224,13,7,69.0279943343,0.0,0.105842107172,0.08639469761,0.0876988685693,0,0,0,0,0,0,0,0,0,0,0,0,0,0,0,0,0,0,0.114285
735,"It was short and wide outside off, Williamson went too hard on the stroke and that foiled all timing .",223,11,10,75.9576532808,0.08639469761,0.0,0.0815161141251,0.0124256980656,0,1,0,0,0,0,0,0,0,0,0,0,0,0,0,0,0,0,0.11986
736,"Nehra to Corey Anderson, leg byes, 1 run, down leg, Corey Anderson failed to tuck that away, off the pad and it runs away behind square.",222,24,8,96.9553857563,0.0815161141251,0.0876988685693,0.0311900747184,0.301875306769,0,0,0,0,0,0,0,0,0,0,0,0,0,0,0,0,0,0,0.12131
737,An extra added to the total .,221,4,3,27.1544976404,0.0311900747184,0.0124256980656,0.038957417207,0.0,0,0,0,0,0,0,0,0,0,0,0,0,0,0,0,0,0,0,0.09091
738,"Nehra to Corey Anderson, no run, that is nice to see.",220,9,5,38.4327326328,0.038957417207,0.301875306769,0.102629366735,0.130392785536,0,0,0,0,0,0,0,0,0,0,0,0,0,0,0,0,0,0,0.10238
739,"Length delivery outside off, Corey Anderson lifts his bat high and then shoulders arms.",219,12,4,63.2888884775,0.102629366735,0.0,0.076955216577,0.0,0,1,0,0,0,0,0,0,0,0,0,0,0,0,0,0,0,0,0.12317
740,"Give respect to balls that deserve the sameCorey Anderson, left handed bat, comes to the crease .",218,14,5,69.1064835137,0.076955216577,0.130392785536,0.0284435573494,0.0363220231047,0,0,0,0,0,0,0,0,0,0,0,0,0,0,0,0,0,0,0.14674
741,"Nehra to Munro, out Caught by Pandya!!",217,7,3,28.1940952697,0.0284435573494,0.0,0.0,0.020636741509,0,1,0,1,0,0,0,0,0,0,0,0,0,0,0,0,0,0,0.12
742,"And just as I say that, he perishes.",216,4,6,30.4013567388,0.0,0.0363220231047,0.0527924354238,0.0262056086763,0,0,0,0,0,0,0,0,0,0,0,0,0,0,0,0,0,0,0.115385
743,"Used his feet to try and loft that over mid-off, the length ball stopped on him a touch and it went off the toe end straight to the fielder at mid-off.",215,17,16,113.335092296,0.0527924354238,0.020636741509,0.0425546896023,0.101144896019,0,0,0,0,0,0,0,0,0,0,0,0,0,0,0,0,0,0,0.181435
744,A dolly and Pandya accepts it gleefully.,214,5,3,30.2912234679,0.0425546896023,0.0262056086763,0.0,0.0,0,0,0,0,0,0,0,0,0,0,0,0,0,0,0,0,0,0,0.11111
745,"Why would you try so many things, without gauging the line, length, what the pitch is doing etc etc, only Munro will know.",213,18,10,118.301276836,0.0,0.101144896019,0.0345794440774,0.0,0,1,0,0,0,0,0,0,0,0,0,0,0,0,0,0,0,0,0.082495
746,"If this continues, New Zealand will be on their way to committing hara-kiri.",212,8,7,52.620927601,0.0345794440774,0.0,0.0,0.0,0,0,0,0,0,0,0,0,0,0,0,0,0,0,0,0,0,0,0.18573
747,"Like Ashwin, Nehra too strikes in his first over.",211,7,4,40.6977388702,0.0,0.0,0.0,0.14851633187,0,0,0,0,0,0,0,0,0,0,0,0,0,0,0,0,0,0,0.243135
748,No big celebrations from the veteran though.,210,5,3,32.9999848057,0.0,0.0,0.0,0.0,0,0,0,0,0,0,0,0,0,0,0,0,0,0,0,0,0,0,0.10989
749,Munro c Pandya b Nehra  . ),209,7,0,13.8453483797,0.0,0.14851633187,0.517673868861,0.0,0,0,0,0,0,0,0,0,0,0,0,0,0,0,0,0,0,0,0.0625
750,"[6s-1]Nehra to Munro, THAT'S OUT!!",208,9,3,17.2175331465,0.517673868861,0.0,0.0,0.0,0,1,0,0,0,0,0,0,0,0,0,0,0,0,0,0,0,0,0.1
751,Caught!!,207,3,0,5.03371994041,0.0,0.0,0.0,0.0,0,0,0,1,0,0,0,0,0,0,0,0,0,0,0,0,0,0,0.0
752,.,206,1,0,0.0,0.0,0.0,0.0,0.0,0,0,0,0,0,0,0,0,0,0,0,0,0,0,0,0,0,0,0.0
753,"Nehra to Munro, no run, this one keeps low and beats Munro's ugly across the line pull.",205,16,5,74.5566192467,0.0,0.0,0.140985707209,0.521204327213,0,0,0,0,0,0,0,0,0,0,0,0,0,0,0,0,0,0,0.12
754,Not there for that shot and Munro needs to get his eye in before trying such audacious strokes .,204,9,10,85.232120646,0.140985707209,0.0,0.157028273066,0.0443290408786,0,0,0,0,0,0,0,0,0,0,0,0,0,0,0,0,0,0,0.13889
755,"Nehra to Munro, no run, Munro shuffles across outside off and is struck outside the line.",203,13,6,60.8052033745,0.157028273066,0.521204327213,0.209495473264,0.103302378464,0,1,0,0,0,0,0,0,0,0,0,0,0,0,0,0,0,0,0.125
756,Went for a big across the line mow and missed.,202,7,4,39.0771410049,0.209495473264,0.0443290408786,0.0311481151755,0.0218104049458,0,0,0,0,0,0,0,0,0,0,0,0,0,0,0,0,0,0,0.12024
757,"The ball rolls off the pad to backward pointAshish Nehra, left-arm fast medium, comes into the attack .",201,14,6,66.3692959724,0.0311481151755,0.103302378464,0.0445500036905,0.0532932983307,0,0,0,0,0,0,0,0,0,0,0,0,0,0,0,0,0,0,0.16848
758,"Ashwin to Williamson, no run, nervy poke outside off and beaten.",200,10,4,43.1572981277,0.0445500036905,0.0218104049458,0.145381967856,0.0,0,1,0,0,0,0,0,0,0,0,0,0,0,0,0,0,0,0,0.11111
759,"Williamson was playing for the turn there, but it went straight on and beat the outside edge.",199,10,9,63.0862980581,0.145381967856,0.0532932983307,0.0276259372645,0.0162548126536,0,1,0,0,0,0,0,0,0,0,0,0,0,0,0,0,0,0,0.142855
760,Not far from taking the nick .,198,4,3,29.0244552395,0.0276259372645,0.0,0.0,0.0987638431385,0,0,0,0,0,0,0,0,0,0,0,0,0,0,0,0,0,0,0.106725
761,"Ashwin to Munro, 1 run, Pandya at mid-off dives to his right and saves three.",197,13,5,51.4136140737,0.0,0.0162548126536,0.115355738759,0.222989543568,0,0,0,0,0,0,0,0,0,0,0,0,0,0,0,0,0,0,0.122805
762,"Good effort for it was blasted to his right, if not for the athleticism it would've been a four .",196,10,12,74.4725778075,0.115355738759,0.0987638431385,0.0116700705348,0.0,0,0,0,0,0,0,0,0,0,1,0,0,0,0,0,0,0,0,0.160175
763,"Ashwin to Munro, SIX, my word!",195,7,2,29.6540030896,0.0116700705348,0.222989543568,0.0,0.0,0,0,0,0,0,0,0,0,1,0,0,0,0,0,0,0,0,0,0.105265
764,Hello!,194,2,0,6.76832099579,0.0,0.0,0.0,0.0,0,0,0,0,0,0,0,0,0,0,0,0,0,0,0,0,0,0,0.0
765,Where did that come from?,193,2,4,24.0551007819,0.0,0.0,0.0,0.0,0,0,0,0,0,0,0,0,0,0,0,0,0,0,0,0,0,0,0.04545
766,A switch hit into the deep point stands.,192,6,3,33.583433069,0.0,0.0,0.0,0.0161290923666,0,0,0,0,0,0,0,0,0,0,0,0,0,0,0,0,0,0,0.115385
767,Munro isn't going to muck around here.,191,6,3,33.253503931,0.0,0.0,0.0,0.0,0,0,0,0,0,0,0,0,0,0,0,0,0,0,0,0,0,0,0.10378
768,Switches and smacks the leather off that.,190,4,4,30.875154539,0.0,0.0161290923666,0.0175493199082,0.0166610615964,0,0,0,0,0,0,0,0,0,0,0,0,0,0,0,0,0,0,0.130435
769,Sailed a long way into the stands.,189,5,3,28.2659449555,0.0175493199082,0.0,0.0178655937295,0.0317583556213,0,0,0,0,0,0,0,0,0,0,0,0,0,0,0,0,0,0,0.08
770,The Kiwi camp is all smiles .,188,4,3,29.3408407176,0.0178655937295,0.0166610615964,0.0301509073842,0.0,0,0,0,0,0,0,0,0,0,0,0,0,0,0,0,0,0,0,0.07143
771,"Ashwin to Munro, no run, tossed up from round the wicket, on the stumps, a forward defenceColin Munro, left handed bat, comes to the crease .",187,22,10,91.7132219089,0.0301509073842,0.0317583556213,0.100454865687,0.0,0,0,0,0,0,1,0,0,0,0,0,0,0,0,0,1,0,0,0.17608
772,"Ashwin to Guptill, out Lbw!!",186,6,2,18.7209567348,0.100454865687,0.0,0.0,0.15520993477,0,1,0,0,0,0,0,0,0,0,0,0,0,0,0,0,0,0,0.086955
773,Huge appeal and gone.,185,4,1,20.84149106,0.0,0.0,0.0,0.0247575917047,0,0,0,0,0,0,0,0,0,0,0,0,0,0,0,0,0,0,0.066665
774,Ashwin has his revenge.,184,3,2,18.5069291504,0.0,0.15520993477,0.0,0.0,0,0,0,0,0,0,0,0,0,0,0,0,0,0,0,0,0,0,0.058825
775,Dharmasena had a long look at that and then raised the finger.,183,6,7,49.1335044553,0.0,0.0247575917047,0.0433120507297,0.0,0,0,0,0,0,0,0,0,0,0,0,0,0,0,0,0,0,0,0.105265
776,"It was tossed up again, spun in and beat the sweep of Guptill, hit on the back leg, pretty adjacent and the only question was it spinning too much?",182,17,16,119.285548853,0.0433120507297,0.0,0.0,0.117528717381,0,0,0,0,0,0,0,0,0,0,0,0,0,0,0,1,0,0,0.14988
777,Hoho!,181,2,0,7.1737861039,0.0,0.0,0.0,0.0,0,0,0,0,0,0,0,0,0,0,0,0,0,0,0,0,0,0,0.0
778,Replays show that it was missing!,180,4,3,28.1804246334,0.0,0.117528717381,0.0520954526025,0.151029724996,0,0,0,0,0,0,0,0,0,0,0,0,0,0,0,0,0,0,0.08041
779,So must say that Guptill is unlucky.,179,5,3,34.2003671301,0.0520954526025,0.0,0.101961877956,0.439224021872,0,0,0,0,0,0,0,0,0,0,0,0,0,0,0,0,0,0,0.040005
780,There is bounce on this wicket and that's why Hawk-Eye showed that it was going over.,178,7,11,59.5354241475,0.101961877956,0.151029724996,0.0579203671114,0.0171669362191,0,0,0,0,0,1,0,0,0,0,0,0,0,0,0,0,0,0,0.100835
781,But must say the adrenaline got the better of Guptill there.,177,7,5,49.4021975786,0.0579203671114,0.439224021872,0.0,0.0,0,0,0,0,0,0,0,0,0,0,0,0,0,0,0,0,0,0,0.178575
782,Ashwin pumps his fist and roars.,176,5,2,30.0822523676,0.0,0.0171669362191,0.296803808488,0.0802774812401,0,0,0,0,0,0,0,0,0,0,0,0,0,0,0,0,0,0,0.058825
783,Nagpur roars as one too.,175,4,2,25.6235168797,0.296803808488,0.0,0.0,0.0,0,0,0,0,0,0,0,0,0,0,0,0,0,0,0,0,0,0,0.086955
784,"Fine comeback from Ashwin and India, but Dharmasena got that wrong there.",174,9,5,54.4781207754,0.0,0.0802774812401,0.0996744948409,0.128527281201,0,0,0,0,0,0,0,0,0,0,0,0,0,0,0,0,0,0,0.09091
785,Guptill lbw b Ashwin  . ),173,6,0,13.746502545,0.0996744948409,0.0,0.450634557039,0.651639101409,0,0,0,0,0,0,0,0,0,0,0,0,0,0,0,0,0,0,0.066665
786,"[6s-1]Ashwin to Guptill, THAT'S OUT!!",172,9,3,16.4255401313,0.450634557039,0.128527281201,0.0,0.0,0,1,0,0,0,0,0,0,0,0,0,0,0,0,0,0,0,0,0.078945
787,Lbw!!,171,3,0,5.22787595485,0.0,0.651639101409,0.0,0.0,0,0,0,0,0,0,0,0,0,0,0,0,0,0,0,0,0,0,0.083335
788,.,170,1,0,0.0,0.0,0.0,0.0,0.0,0,0,0,0,0,0,0,0,0,0,0,0,0,0,0,0,0,0,0.0
789,"Ashwin to Guptill, SIX, Kaboom!",169,7,1,23.2221543304,0.0,0.0,0.271446631562,0.0,0,0,0,0,0,0,0,0,1,0,0,0,0,0,0,0,0,0,0.114285
790,What is Guptill up to?,168,2,4,18.7087125113,0.271446631562,0.0,0.0,0.0,0,0,0,0,0,0,0,0,0,0,0,0,0,0,0,0,0,0,0.09524
791,Unbelievable blow!,167,3,0,13.2489599191,0.0,0.0,0.0,0.0,0,0,0,0,0,0,0,0,0,0,0,0,0,0,0,0,0,0,0.0
792,First ball - no sighters or anything.,166,6,2,31.1869863365,0.0,0.0,0.0,0.0,0,0,0,0,0,0,0,0,0,0,0,0,0,0,0,0,0,0,0.08497
793,Sees the tossed up delivery and out comes the loft.,165,6,5,39.4513244974,0.0,0.0,0.0298345796635,0.0922759745934,0,1,0,0,0,0,0,0,0,0,0,0,0,0,0,1,0,0,0.115385
794,"Straight as a die, back over the bowler's head.",164,8,4,36.7892332732,0.0298345796635,0.0,0.0163366196094,0.0,0,0,0,0,0,0,0,0,0,0,0,0,0,0,0,0,0,0,0.13158
795,That came out off the bat like a shotgun.,163,5,5,33.0949242428,0.0163366196094,0.0922759745934,0.0,0.0235655325165,0,1,0,0,0,0,0,0,0,0,0,0,0,0,0,0,0,0,0.155555
796,Would've surprised and shocked both Ashwin and Mahendra Singh Dhoni in equal measure.,162,11,4,64.6917306861,0.0,0.0,0.0,0.0,0,0,0,0,0,0,0,0,0,0,0,0,0,0,0,0,0,0,0.16042
797,What a start to the game.,161,3,4,19.4210957486,0.0,0.0235655325165,0.0225525821373,0.133283284476,0,0,0,0,0,0,0,0,0,0,0,0,0,0,0,0,0,0,0.17045
798,That should set the adrenaline racing.,160,4,3,30.0832220529,0.0225525821373,0.0,0.0383314326383,0.0,0,0,0,0,0,0,0,0,0,0,0,0,0,0,0,0,0,0,0.08497
799,Guptill has made a statement of intent and what a statement that isGuptill and Williamson are at the crease.,159,9,11,76.4226944342,0.0383314326383,0.133283284476,0.125780104779,0.0155121206284,0,0,0,0,0,0,0,0,0,0,0,0,0,0,0,0,0,0,0.11724
800,Guptill is on strike.,158,3,2,16.0673396895,0.125780104779,0.0,0.0,0.0826519472433,0,0,0,0,0,0,0,0,0,0,0,0,0,0,0,0,0,0,0.035715
801,Ashwin will open the attackNow time for the national anthems.,157,7,4,46.4214869144,0.0,0.0155121206284,0.0,0.176201718033,0,0,0,0,0,0,0,0,0,0,0,0,0,0,0,0,0,0,0.11111
802,First up it is New Zealand's followed by India's.,156,8,4,37.3550646741,0.0,0.0826519472433,0.0,0.0441796614872,0,0,0,0,0,0,0,0,0,0,0,0,0,0,0,0,0,0,0.22085
803,The anthems are done - sung with lots of passion and gusto.,155,8,5,55.2859521822,0.0,0.176201718033,0.0101212075409,0.0134042646567,0,0,0,0,0,0,0,0,0,0,0,0,0,0,0,0,0,0,0.13793
804,That is the great thing about these ICC events.,154,5,5,44.0708866547,0.0101212075409,0.0441796614872,0.0154693953519,0.0182019724399,0,1,0,0,0,0,0,0,0,0,0,0,0,0,0,0,0,0,0.08
805,Out come the Kiwi openers.,153,4,2,24.2432546614,0.0154693953519,0.0134042646567,0.024106220021,0.0671784416031,0,1,0,0,0,0,0,0,0,0,0,0,0,0,0,0,0,0,0.105265
806,"The crowd are in rip-roaring spirits, bellowing at the top of their voice.",152,8,7,54.2912310658,0.024106220021,0.0182019724399,0.0294851561566,0.0175676800935,0,0,0,0,0,0,0,0,0,0,0,0,0,0,0,0,0,0,0.136365
807,A fantastic atmosphere out there in Nagpur.,151,4,4,30.5219062334,0.0294851561566,0.0671784416031,0.0,0.0,0,1,0,0,0,0,0,0,0,0,0,0,0,0,0,0,0,0,0.08993
808,Looks like India will start with Ashwin and yes it is the offie.,150,8,6,54.4964784588,0.0,0.0175676800935,0.181786580944,0.00745378529289,0,0,0,0,0,0,0,0,0,0,0,0,0,0,0,0,0,0,0.188145
809,All set for the action to start.,149,4,4,28.7887066695,0.181786580944,0.0,0.0209307328328,0.0224914406496,0,0,0,0,0,0,0,0,0,0,0,0,0,0,0,0,0,0,0.13333
810,Let's play!An emotional tribute to the late Martin Crowe read out so beautifully by Alan Wilkins.,148,14,6,92.5692417464,0.0209307328328,0.00745378529289,0.0113397891057,0.00942176163085,0,1,0,0,0,0,0,0,0,0,0,0,0,0,0,0,0,0,0.203465
811,The crowd rise as one.,147,4,2,22.2103909271,0.0113397891057,0.0224914406496,0.0209236733702,0.118717861366,0,0,0,0,0,0,0,0,0,0,0,0,0,0,0,0,0,0,0.14091
812,And the players clap in unison.,146,4,3,27.6715424172,0.0209236733702,0.00942176163085,0.0127899531802,0.0218176518722,0,0,0,0,0,0,0,0,0,0,0,0,0,0,0,0,0,0,0.142855
813,Fine gesture to one of the all-time greats of New Zealand cricket.,145,9,4,47.5332321303,0.0127899531802,0.118717861366,0.0,0.00984930051149,0,0,0,0,0,0,0,0,0,0,0,0,0,0,0,0,0,0,0.19637
814,Ross Taylor and Martin Guptill certainly seem emotional.,144,8,1,41.8767904804,0.0,0.0218176518722,0.0168013601549,0.0,0,0,0,0,0,0,0,0,0,0,0,0,0,0,0,0,0,0,0.08424
815,A few placards and banners in the crowd eulogising Crowe.,143,6,5,45.8787147242,0.0168013601549,0.00984930051149,0.0,0.105624831699,0,0,0,0,0,0,0,0,0,0,0,0,0,0,0,0,0,0,0.188145
816,That is nice to see.,142,3,3,20.0968703097,0.0,0.0,0.0109140451328,0.0456602779401,0,0,0,0,0,0,0,0,0,0,0,0,0,0,0,0,0,0,0.04762
817,Certainly the Nagpur crowd have come prepared for this gameVery big call from Kane Williamson to play three spinners and drop their two premier fast bowlers in Southee and Boult.,141,21,10,145.002130054,0.0109140451328,0.105624831699,0.0295898171869,0.0375040088591,0,1,0,0,0,0,0,0,0,0,0,0,0,0,1,0,0,0,0.2129
818,A major gamble but Scott Styris on air expected that from the BlackCaps.,140,8,6,61.2928329715,0.0295898171869,0.0456602779401,0.0,0.0125481728984,0,0,0,0,0,0,0,0,0,0,0,0,0,0,0,0,0,0,0.090075
