,sentences,pos,len,len_stop,tfidf,sim_p,sim_pp,sim_n,sim_nn,century,out,bold,caught,stumped,wicket,hattrick,catch,six,four,amazing,hundred,ton,boundary,drop,toss,won,lost,score
552,"Al-Amin to Ahmed Shehzad, 1 run, length ball on off, Shehzad tries to force it through the off-side, but his bat turns on impact and he drags it down to long-on .",286,21,15,95.1158501295,0.347046176271,0.0991814535203,0.245582632966,0.478909788985,0,0,0,0,0,0,0,0,0,0,0,0,0,0,0,0,0,0,0.138545
553,"Al-Amin to Ahmed Shehzad, FOUR, slower short ball, sits up to be hit as all the pace is sucked out and Shehzad hammers the pull through square leg after fetching the ball from around waist height .",285,25,15,145.375343896,0.245582632966,0.169768855335,0.321027642008,0.0,0,1,0,0,0,0,0,0,0,1,0,0,0,0,0,0,0,0,0.131705
554,"Al-Amin to Ahmed Shehzad, no run, he's down on pace.",284,9,5,29.4669499537,0.321027642008,0.478909788985,0.0,0.0,0,0,0,0,0,0,0,0,0,0,0,0,0,0,0,0,0,0,0.140525
555,Just  .,283,1,1,4.01982982513,0.0,0.0,0.0,0.0,0,0,0,0,0,0,0,0,0,0,0,0,0,0,0,0,0,0,0.05555
556,ks.,282,2,0,7.04025471128,0.0,0.0,0.0,0.0,0,0,0,0,0,0,0,0,0,0,0,0,0,0,0,0,0,0,0.0
557,Or maybe this is the warm-up ball.,281,4,4,23.5238984547,0.0,0.0,0.0,0.0,0,0,0,0,0,0,0,0,0,0,0,0,0,0,0,0,0,0,0.133035
558,"Short of length outside off, chopped to backward pointAl-Amin Hossain [ .",280,10,3,34.6538986579,0.0,0.0,0.0,0.0,0,1,0,0,0,0,0,0,0,0,0,0,0,0,0,0,0,0,0.144595
559,- .,279,2,0,0.0,0.0,0.0,0.0,0.0,0,0,0,0,0,0,0,0,0,0,0,0,0,0,0,0,0,0,0.0
560,. ],278,2,0,0.0,0.0,0.0,0.0,0.0,0,0,0,0,0,0,0,0,0,0,0,0,0,0,0,0,0,0,0.0
561,is back into the attack .,277,3,3,17.0056488789,0.0,0.0,0.0697008480166,0.0182990690065,0,0,0,0,0,0,0,0,0,0,0,0,0,0,0,0,0,0,0.0625
562,"Shakib to Hafeez, 2 runs, drops it slightly short with enough width outside off, Hafeez's emphasis is all on placement and timing at the moment.",276,20,10,99.1499147956,0.0697008480166,0.0,0.0166574075988,0.157247328802,0,1,0,0,0,0,0,0,0,0,0,0,0,0,1,0,0,0,0.13745
563,Laces the cut past backward point and collects another couple before sweeper cover tidies up .,275,12,4,74.7435982184,0.0166574075988,0.0182990690065,0.0,0.02835751683,0,0,0,0,0,0,0,0,0,0,0,0,0,0,0,0,0,0,0.08108
564,"Shakib to Hafeez, no run, oh well bowled.",274,9,2,29.0535608396,0.0,0.157247328802,0.0602219498022,0.161509287786,0,0,0,0,0,0,0,0,0,0,0,0,0,0,0,0,0,0,0.11111
565,"Lovely flight on the ball outside off, as a result he generated extra bounce and the ball looped over Hafeez's attempted sweep through to the keeper .",273,17,12,103.534220615,0.0602219498022,0.02835751683,0.070441530415,0.0688783124066,0,1,0,0,0,0,0,0,0,0,0,0,0,0,0,0,0,0,0.143205
566,"Shakib to Hafeez, FOUR, there's the footwork which is so brilliant.",272,9,6,45.1451160898,0.070441530415,0.161509287786,0.0380832054054,0.0179015263944,0,0,0,0,0,0,0,0,0,1,0,0,0,0,0,0,0,0,0.121215
567,"Almost jumps back in the crease seeing the length trifle short, allows him the time and room to put it anywhere.",271,15,8,87.0228985169,0.0380832054054,0.0688783124066,0.0372041670361,0.00950324324387,0,0,0,0,0,0,0,0,0,0,0,0,0,0,0,0,0,0,0.156585
568,Spanks the pull wide of long-on .,270,5,2,20.5728507477,0.0372041670361,0.0179015263944,0.156525335764,0.0,0,0,0,0,0,0,0,0,0,0,0,0,0,0,0,0,0,0,0.12
569,"Shakib to Hafeez, 2 runs, too full outside off, sliced wide of backward point.",269,14,4,50.9487199974,0.156525335764,0.00950324324387,0.0222114884679,0.0656360111953,0,1,0,0,0,0,0,0,0,0,0,0,0,0,0,0,0,0,0.088885
570,"Sweeper cover is forced into a sprint, then has to dive to flick it back in .",268,9,9,64.3115409832,0.0222114884679,0.0,0.0696724530104,0.0534907665393,0,0,0,0,0,0,0,0,0,0,0,0,0,0,0,0,0,0,0.08163
571,"Shakib to Ahmed Shehzad, 1 run, slider on middle, Shehzad is down the track looking to slog.",267,15,6,59.0815220825,0.0696724530104,0.0656360111953,0.0827080762274,0.254893824086,0,0,0,0,0,0,0,0,0,0,0,0,0,0,0,0,0,0,0.13158
572,Drags it off the inside half to long-on .,266,5,4,25.5003972295,0.0827080762274,0.0534907665393,0.0339376412514,0.0691697525185,0,0,0,0,0,0,0,0,0,0,0,0,0,0,0,0,0,0,0.129035
573,"Shakib to Ahmed Shehzad, no run, ooh, nearly runs past the delivery.",265,13,3,46.5539190366,0.0339376412514,0.254893824086,0.0894930750713,0.0729476942819,0,0,0,0,0,0,0,0,0,0,0,0,0,0,0,0,0,0,0.09881
574,"Shakib saw him coming and darted it short, got it to grip and turn as well but to his chagrin, Shehzad manages a thick outside edge to backward point .",264,20,12,115.817100841,0.0894930750713,0.0691697525185,0.0182003122524,0.0,0,1,0,0,0,0,0,0,0,0,0,0,0,0,0,0,0,0,0.12903
575,"S Rahman to Hafeez, 2 runs, in many ways, this has been such an un-Pakistan like partnership.",263,13,8,64.6475052691,0.0182003122524,0.0729476942819,0.0,0.0236634858697,0,0,0,0,0,0,0,0,0,0,0,0,0,0,0,0,0,0,0.10417
576,"Sensible batting, good running.",262,6,0,22.4180156573,0.0,0.0,0.0,0.0,0,0,0,0,0,0,0,0,0,0,0,0,0,0,0,0,0,0,0.142855
577,Nudged softly in front of deep mid-wicket and then hares back for a couple .,261,9,6,54.4432451991,0.0,0.0236634858697,0.0,0.0210736157723,0,0,0,0,0,1,0,0,0,0,0,0,0,0,0,0,0,0,0.13668
578,"S Rahman to Hafeez, no run, guided into the off-side with the turn .",260,9,7,37.6519716758,0.0,0.0,0.278777304224,0.183742323488,0,0,0,0,0,0,0,0,0,0,0,0,0,0,0,0,0,0,0.15833
579,"S Rahman to Hafeez, no run, quicker through the air, lands on a length on middle and leg, Hafeez is only slightly forward and pats it gently after letting it turn .",259,21,15,116.374877077,0.278777304224,0.0210736157723,0.145864626805,0.168458647229,0,0,0,0,0,0,0,0,0,0,0,0,0,0,0,0,0,0,0.138145
580,"S Rahman to Ahmed Shehzad, 1 run, slips towards the pads after drifting on with the arm, clipped behind square .",258,17,7,74.1790235488,0.145864626805,0.183742323488,0.242477314243,0.229988963713,0,0,0,0,0,0,0,0,0,0,0,0,0,0,0,0,0,0,0.14286
581,"S Rahman to Ahmed Shehzad, no run, yorks himself after racing out of the crease, jams it back to the bowler .",257,14,11,75.0441478238,0.242477314243,0.168458647229,0.305778113159,0.0482028135466,0,1,0,0,0,0,0,0,0,0,0,0,0,0,0,0,0,0,0.14795
582,"S Rahman to Ahmed Shehzad, FOUR, Rahman introduces himself with a stinker.",256,10,5,43.3589224475,0.305778113159,0.229988963713,0.0578361624566,0.0,0,0,0,0,0,0,0,0,0,1,0,0,0,0,0,0,0,0,0.1232
583,"Short on middle and leg, Shehzad remains composed though.",255,9,2,39.7686746735,0.0578361624566,0.0482028135466,0.0673706255353,0.0397898885077,0,0,0,0,0,0,0,0,0,0,0,0,0,0,0,0,0,0,0.064515
584,Goes deep in the crease and whips it wide of long-on.,254,7,5,35.1300264287,0.0673706255353,0.0,0.0290056621772,0.0595084564658,0,0,0,0,0,0,0,0,0,0,0,0,0,0,0,0,0,0,0.178055
585,"Good orthodox cricketSabbir Rahman, right-arm leg break, comes into the attackBoth these Pakistani batsmen are playing it smartly.",253,16,5,85.9033883951,0.0290056621772,0.0397898885077,0.0126699864624,0.0,0,0,0,0,0,0,0,0,0,0,0,0,0,0,0,0,0,0,0.075
586,Knowing when to step it up and when to just nudge and nurdle.,252,5,9,55.7364081558,0.0126699864624,0.0595084564658,0.0,0.0168337741714,0,0,0,0,0,0,0,0,0,0,0,0,0,0,0,0,0,0,0.088235
587,.,251,1,0,0.0,0.0,0.0,0.0,0.0,0,0,0,0,0,0,0,0,0,0,0,0,0,0,0,0,0,0,0.0
588,"Shakib to Ahmed Shehzad, 1 run, is beaten by the length after running down the track, still goes across the line.",250,17,8,75.333409606,0.0,0.0168337741714,0.101002466085,0.150830065346,0,0,0,0,0,0,0,0,0,0,0,0,0,0,0,0,0,0,0.14795
589,The ball holds up on him and a soft leading edge rolls away wide of a diving Shakib down to long-on .,249,12,10,74.6657385423,0.101002466085,0.0,0.149460780041,0.157689379459,0,0,0,0,0,0,0,0,0,0,0,0,0,0,0,0,0,0,0.176715
590,"Shakib to Hafeez, 1 run, shuffles to leg as the ball slides on quickly from a length, twirls his wrists on the punch to get it through the covers .",248,19,14,104.500964041,0.149460780041,0.150830065346,0.0701676891991,0.201806226874,0,0,0,0,0,0,0,0,0,0,0,0,0,0,0,0,0,0,0.149255
591,"Shakib to Ahmed Shehzad, 1 run, teased up just outside off, Shehzad plonks across and knocks it wide of cover .",247,17,7,74.0735765927,0.0701676891991,0.157689379459,0.0882102325104,0.098502539557,0,1,0,0,0,0,0,0,0,0,0,0,0,0,0,0,0,0,0.113635
592,"Shakib to Hafeez, 1 run, slower and fuller on middle, flicked through mid-wicket.",246,13,4,41.6246806277,0.0882102325104,0.201806226874,0.0130719271873,0.111035339451,0,0,0,0,0,1,0,0,0,0,0,0,0,0,0,0,0,0,0.088885
593,The lack of turn is allowing them to play across the line .,245,7,6,48.9258654927,0.0130719271873,0.098502539557,0.0698209750601,0.0234076616501,0,0,0,0,0,0,0,0,0,0,0,0,0,0,0,0,0,0,0.13889
594,"Shakib to Ahmed Shehzad, 1 run, nurdled behind square, went deep in the crease and allows the ball to slide on before helping it with the angle .",244,20,11,98.4902984012,0.0698209750601,0.111035339451,0.10336619791,0.0,0,0,0,0,0,0,0,0,0,0,0,0,0,0,0,0,0,0,0.177275
595,"Shakib to Hafeez, 1 run, flatter on middle, clipped to long-onShakib Al Hasan [ .",243,15,3,42.4980320166,0.10336619791,0.0234076616501,0.0,0.0,0,0,0,0,0,0,0,0,0,0,0,0,0,0,0,0,0,0,0.114285
596,- .,242,2,0,0.0,0.0,0.0,0.0,0.0,0,0,0,0,0,0,0,0,0,0,0,0,0,0,0,0,0,0,0.0
597,. ],241,2,0,0.0,0.0,0.0,0.0,0.0,0,0,0,0,0,0,0,0,0,0,0,0,0,0,0,0,0,0,0.0
598,is back into the attack .,240,3,3,17.0056488789,0.0,0.0,0.0,0.0479409135826,0,0,0,0,0,0,0,0,0,0,0,0,0,0,0,0,0,0,0.0625
599,"Mortaza to Ahmed Shehzad, FOUR, my word!",239,8,2,29.9740584199,0.0,0.0,0.0,0.0788504737825,0,0,0,0,0,0,0,0,0,1,0,0,0,0,0,0,0,0,0.090905
600,That's replete with timing and all the elegance in the world.,238,6,7,45.6182736504,0.0,0.0479409135826,0.0427922285065,0.0461122338524,0,0,0,0,0,0,0,0,0,0,0,0,0,0,0,0,0,0,0.178055
601,"Shortish just outside off, Shehzad sees that there isn't much room to cut.",237,10,6,53.9572186167,0.0427922285065,0.0788504737825,0.0,0.0503290939705,0,1,0,0,0,0,0,0,0,0,0,0,0,0,0,0,0,0,0.06383
602,So he waits for the ball and dabs it behind backward point.,236,7,6,47.1862662021,0.0,0.0461122338524,0.0199275390882,0.0201228030164,0,0,0,0,0,0,0,0,0,0,0,0,0,0,0,0,0,0,0.15936
603,Speeds off the outfield .,235,3,2,17.973330272,0.0199275390882,0.0503290939705,0.0,0.0134712658031,0,1,0,0,0,0,0,0,0,0,0,0,0,0,0,0,0,0,0.066665
604,"Mortaza to Hafeez, 1 run, goes back and nudges a back of a length delivery to deep mid-wicket .",234,15,6,47.0411345674,0.0,0.0201228030164,0.183246119883,0.0517376264481,0,0,0,0,0,1,0,0,0,0,0,0,0,0,0,0,0,0,0.139535
605,"Mortaza to Ahmed Shehzad, 1 run, Shehzad's heart was pounding once he came down the track and saw Mortaza shortening his length.",233,18,8,87.2009195813,0.183246119883,0.0134712658031,0.0759668203926,0.0345567985693,0,0,0,0,0,0,0,0,0,0,0,0,0,0,0,0,0,0,0.17269
606,Tried to go through with the on-the-rise cover drive and then skipped around to see where the ball was.,232,10,10,73.0437335287,0.0759668203926,0.0517376264481,0.0,0.0224493259588,0,0,0,0,0,0,0,0,0,0,0,0,0,0,0,0,0,0,0.15936
607,He had chopped it off a thick inside edge behind square .,231,7,5,44.1840098544,0.0,0.0345567985693,0.0297693112853,0.0174291895137,0,0,0,0,0,0,0,0,0,0,0,0,0,0,0,0,0,0,0.07143
608,"Mortaza to Ahmed Shehzad, FOUR, it's actually not all that short.",230,10,5,40.8549145163,0.0297693112853,0.0224493259588,0.103288159862,0.0305967246045,0,0,0,0,0,0,0,0,0,1,0,0,0,0,0,0,0,0,0.09881
609,"Even if it is, the ball doesn't get up that much and the odds are stacked up against Shehzad's attempted pull.",229,13,12,90.6953006107,0.103288159862,0.0174291895137,0.0473078196654,0.0456321378518,0,0,0,0,0,0,0,0,0,0,0,0,0,0,0,0,0,0,0.112145
610,He swivels across and swings it over and behind square leg.,228,7,5,43.0106689832,0.0473078196654,0.0305967246045,0.121870494126,0.0603619727885,0,0,0,0,0,0,0,0,0,0,0,0,0,0,0,0,0,0,0.087445
611,Got enough bat on it and beats the man chasing at fine leg .,227,9,5,53.9104355849,0.121870494126,0.0456321378518,0.129054114957,0.106530551821,0,0,0,0,0,0,0,0,0,0,0,0,0,0,0,0,0,0,0.125005
612,"Mortaza to Hafeez, 1 run, fullish and Hafeez places it between the fielders at long-on and deep mid-wicket with a turn of the wrists, the two should have been on but the duo stray towards caution .",226,22,18,130.540208087,0.129054114957,0.0603619727885,0.179151705184,0.161683979722,0,0,0,0,0,1,0,0,0,0,0,0,0,0,0,0,0,0,0.179235
613,"Mortaza to Ahmed Shehzad, 1 run, back of a length delivery on middle and leg, Shehzad glances it behind squareMashrafe Mortaza, right-arm fast medium, comes into the attackMortaza grabs the ball and has the keeper up to the stumps.. .",225,30,15,131.647018387,0.179151705184,0.106530551821,0.0954063962718,0.0492181130582,0,0,0,0,0,0,0,0,0,0,0,0,0,0,0,0,0,0,0.149965
614,"A Sunny to Hafeez, SIX, tossed up, Hafeez is down the track and .. poof!",224,12,7,51.4054067033,0.0954063962718,0.161683979722,0.0,0.0942639189546,0,0,0,0,0,0,0,0,1,0,0,0,0,0,0,1,0,0,0.14921
615,It's disappeared over long-on.,223,4,2,13.2724158305,0.0,0.0492181130582,0.0,0.0,0,0,0,0,0,0,0,0,0,0,0,0,0,0,0,0,0,0,0.09091
616,This has been a masterclass from Hafeez so far in playing spin.,222,6,7,51.4021114699,0.0,0.0942639189546,0.0,0.10257068668,0,0,0,0,0,0,0,0,0,0,0,0,0,0,0,0,0,0,0.08571
617,Now and again he's using his feet to put them off their lengths.,221,6,9,58.827604356,0.0,0.0,0.0727439978627,0.0382219788175,0,0,0,0,0,0,0,0,0,0,0,0,0,0,0,0,0,0,0.125
618,This time he moved towards leg as well to create enough room so that his batswing isn't hindered .,220,12,8,80.1101382936,0.0727439978627,0.10257068668,0.0457706018515,0.0611155446162,0,0,0,0,0,0,0,0,0,0,0,0,0,0,0,0,0,0,0.113635
619,"A Sunny to Ahmed Shehzad, 1 run, sliding on from a length on off, clipped with the angle through square leg .",219,15,10,65.8098402321,0.0457706018515,0.0382219788175,0.282696477476,0.135114198363,0,0,0,0,0,0,0,0,0,0,0,0,0,0,0,0,0,0,0.125
620,"A Sunny to Hafeez, 1 run, shuffles to leg to counter the arm-ball skidding on from middle, whips it to long-on .",218,16,9,61.6193297107,0.282696477476,0.0611155446162,0.206036962781,0.137674824436,0,0,0,0,0,0,0,0,0,0,0,0,0,0,0,0,0,0,0.136365
621,"A Sunny to Hafeez, no run, marvellous flight.",217,8,3,28.525645635,0.206036962781,0.135114198363,0.0546557572916,0.124391143343,0,0,0,0,0,0,0,0,0,0,0,0,0,0,0,0,0,0,0.12
622,"Lobs it above the batsman's eyeline, then gets it to dip on a length out of Hafeez's reach, grips the surface and rips past his outside edge as he tries to dab it into the off-side .",216,22,19,141.99787864,0.0546557572916,0.137674824436,0.0728126218763,0.160219303272,0,1,0,0,0,0,0,0,0,0,0,0,0,0,0,0,0,0,0.174975
623,"A Sunny to Ahmed Shehzad, 1 run, looped up judiciously and drifting in towards off from round the wicket, driven down to long-off .",215,17,10,78.6560743019,0.0728126218763,0.124391143343,0.135667209658,0.0986773700462,0,0,0,0,0,1,0,0,0,0,0,0,0,0,0,0,0,0,0.15168
624,"A Sunny to Hafeez, 1 run, slower through the air on off, Hafeez comes forward, waits for the turn and opens the bat-face to steer it wide of short third man.",214,23,13,105.030736766,0.135667209658,0.160219303272,0.141182525709,0.0719976494883,0,0,0,0,0,0,0,0,0,0,0,0,0,0,0,0,0,0,0.17857
625,Not enough pace on the ball to get it through the manPowerplay done and Pakistan are up and running.,213,9,11,72.1511113011,0.141182525709,0.0986773700462,0.020618765794,0.0,0,0,0,0,0,0,0,0,0,0,0,0,0,0,0,0,0,0,0.133335
626,55 scored already for the loss of just one wicket.,212,7,4,46.1117094312,0.020618765794,0.0719976494883,0.0318349810185,0.0,0,0,0,0,0,1,0,0,0,0,0,0,0,0,0,0,0,0,0.140485
627,"Although, from Bangladesh's point of view, this pitch looks good.",211,11,3,46.7801877573,0.0318349810185,0.0,0.0,0.0950270611364,0,0,0,0,0,0,0,0,0,0,0,0,0,0,0,0,0,0,0.186365
628,.,210,1,0,0.0,0.0,0.0,0.0,0.0,0,0,0,0,0,0,0,0,0,0,0,0,0,0,0,0,0,0,0.0
629,"Shakib to Hafeez, 1 run, advances, doesn't get to the pitch and settles for a push to mid-off.",209,15,8,57.4810757872,0.0,0.0950270611364,0.0235588593709,0.287889528364,0,0,0,0,0,0,0,0,0,0,0,0,0,0,0,0,0,0,0.1564
630,Shehzad is comfortably home with a dive at the striker's end but ends up ramming into Rahim's foot and sends the Bangladeshi keeper hobbling .,208,17,10,111.452251713,0.0235588593709,0.0,0.0242593966785,0.0246838657279,0,0,0,0,0,0,0,0,0,0,0,0,0,0,0,0,0,0,0.127275
631,"Shakib to Hafeez, FOUR, he's met the pitch of this one and blazed it straight of mid-off.",207,13,8,59.251655072,0.0242593966785,0.287889528364,0.096915148689,0.158367448422,0,0,0,0,0,0,0,0,0,1,0,0,0,0,0,0,0,0,0.14
632,Lovely use of the feet again and absolutely drilled it hard .,206,7,5,51.7195440774,0.096915148689,0.0246838657279,0.015010978577,0.0146479855985,0,0,0,0,0,0,0,0,0,0,0,0,0,0,0,0,0,0,0.11602
633,"Shakib to Hafeez, no run, pushed back to the bowler .",205,9,4,32.5234963919,0.015010978577,0.158367448422,0.135469255272,0.120032933014,0,0,0,0,0,0,0,0,0,0,0,0,0,0,0,0,0,0,0.16352
634,"Shakib to Hafeez, wide, there's a loud appeal for a stumping and we are going upstairs.",204,12,8,64.2385144887,0.135469255272,0.0146479855985,0.0171365122027,0.0,0,0,0,0,0,0,0,0,0,0,0,0,0,0,0,0,0,0,0.10978
635,"In real time it looked like despite falling over with his back foot, he managed to swivel across and get the front foot back.",203,17,9,102.879972769,0.0171365122027,0.120032933014,0.0,0.128806067899,0,0,0,0,0,0,0,0,0,0,0,0,0,0,0,0,0,0,0.149025
636,Yes.,202,2,0,6.34710753072,0.0,0.0,0.0,0.0,0,0,0,0,0,0,0,0,0,0,0,0,0,0,0,0,0,0,0.0
637,Does so in time.,201,2,3,17.9040702577,0.0,0.128806067899,0.0,0.0,0,0,0,0,0,0,0,0,0,0,0,0,0,0,0,0,0,0,0.125
638,NOT OUT flashes on the big screen to huge roars.,200,6,5,46.0460350924,0.0,0.0,0.0,0.0359959867339,0,1,0,0,0,0,0,0,0,0,0,0,0,0,0,0,0,0,0.106005
639,This crowd surprises me.,199,3,2,23.5508611176,0.0,0.0,0.0,0.0,0,0,0,0,0,0,0,0,0,0,0,0,0,0,0,0,0,0,0.0
640,"Sliding on down leg with the arm, Hafeez misses with his tuck but overbalances slightly.",198,10,7,65.1515615671,0.0,0.0359959867339,0.0,0.134164323272,0,0,0,0,0,0,0,0,0,0,0,0,0,0,0,0,0,0,0.125
641,Back in time .,197,3,1,10.849426809,0.0,0.0,0.113215250401,0.113690628135,0,0,0,0,0,0,0,0,0,0,0,0,0,0,0,0,0,0,0.142855
642,"Shakib to Hafeez, FOUR, he's done in by the length but goes through with the chip backing himself to clear mid-off which was up in the ring.",196,15,16,102.730667991,0.113215250401,0.134164323272,0.0493417955115,0.139606773367,0,0,0,0,0,0,0,0,0,1,0,0,0,0,0,0,0,0,0.160285
643,"Ventured out of the crease, Shakib tossed it slower while holding it back.",195,9,6,54.6146496225,0.0493417955115,0.113690628135,0.0478704437863,0.0612018013313,0,1,0,0,0,0,0,0,0,0,0,0,0,0,0,1,0,0,0.131255
644,The lack of turn allowed Hafeez to go through .,194,6,4,36.440373253,0.0478704437863,0.139606773367,0.08338702283,0.0335688165047,0,0,0,0,0,0,0,0,0,0,0,0,0,0,0,0,0,0,0.151515
645,"Shakib to Ahmed Shehzad, 1 run, yanks the length back seeing Shehzad come down, also follows him and is able to keep him to a flick through mid-wicketShakib is twirling in from round the wicket.. .",193,24,15,124.618371435,0.08338702283,0.0612018013313,0.166337877835,0.0590477509948,0,0,0,0,0,1,0,0,0,0,0,0,0,0,0,0,0,0,0.130865
646,"Shakib to Ahmed Shehzad, no run, goes back to a fullish ball on middle, pats it back down the pitchShakib Al Hasan, left-arm orthodox, comes into the attackMore left-arm spin.",192,26,10,107.29497052,0.166337877835,0.0335688165047,0.106230657228,0.0427959579844,0,0,0,0,0,0,0,0,0,0,0,0,0,0,0,0,0,0,0.18942
647,Shakib on now.,191,2,2,10.7238005959,0.106230657228,0.0590477509948,0.0,0.0,0,0,0,0,0,0,0,0,0,0,0,0,0,0,0,0,0,0,0.083335
648,Shehzad has been perenially bothered by the sight-screen.,190,5,4,32.6550412778,0.0,0.0427959579844,0.0,0.0,0,0,0,0,0,0,0,0,0,0,0,0,0,0,0,0,0,0,0.116015
649,More issues.,189,2,1,11.8032421375,0.0,0.0,0.0,0.0,0,0,0,0,0,0,0,0,0,0,0,0,0,0,0,0,0,0,0.04762
650,.,188,1,0,0.0,0.0,0.0,0.0,0.0,0,0,0,0,0,0,0,0,0,0,0,0,0,0,0,0,0,0,0.0
651,"A Sunny to Hafeez, no run, shortish just outside off, Hafeez is cramped for room on the cut and hits it to cover point .",187,16,12,82.5189219187,0.0,0.0,0.251898302535,0.135643427249,0,1,0,0,0,0,0,0,0,0,0,0,0,0,0,0,0,0,0.125
652,"A Sunny to Hafeez, no run, dances down again, this time Sunny has held it back in flight, so unlike the lesser experienced Sharjeel, Hafeez adjusts and defensively dinks it into the on-side .",186,24,15,134.983944148,0.251898302535,0.0,0.131664753523,0.10652282729,0,0,0,0,0,0,0,0,0,0,0,0,0,0,0,0,0,0,0.14878
653,"A Sunny to Ahmed Shehzad, 1 run, flatter arm-ball on middle, nudged wide of the bowler .",185,15,5,48.727750038,0.131664753523,0.135643427249,0.211119884642,0.0,0,0,0,0,0,0,0,0,0,0,0,0,0,0,0,0,0,0,0.153845
654,"A Sunny to Ahmed Shehzad, FOUR, the shots keep coming from Pakistan.",184,11,4,45.1162320359,0.211119884642,0.10652282729,0.0,0.0800877189975,0,0,0,0,0,0,0,0,0,1,0,0,0,0,0,0,0,0,0.15152
655,This one is beautifully executed.,183,4,2,23.8080737941,0.0,0.0,0.0,0.0,0,0,0,0,0,0,0,0,0,0,0,0,0,0,0,0,0,0,0.02778
656,"Skipped out of the crease, moved away from the line of the ball as it drifted in towards the stumps, got to the pitch and lofted it inside-out over extra-cover.",182,17,16,103.190809824,0.0,0.0800877189975,0.0,0.102559004493,0,1,0,0,0,0,0,0,0,0,0,0,0,0,0,0,0,0,0.161375
657,Pinpoint precision .,181,3,0,14.0805094226,0.0,0.0,0.0,0.0,0,0,0,0,0,0,0,0,0,0,0,0,0,0,0,0,0,0,0.041665
658,"A Sunny to Ahmed Shehzad, no run, turning from a length on off, Shehzad adjusts with his hands and pats it towards point .",180,16,11,80.6305847868,0.0,0.102559004493,0.106260055813,0.073546013149,0,0,0,0,0,0,0,0,0,0,0,0,0,0,0,0,0,0,0.12069
659,"A Sunny to Hafeez, 1 run, nudged to short fine leg and the chaotic running continues.",179,14,5,55.9046626074,0.106260055813,0.0,0.00991925339895,0.0,0,0,0,0,0,0,0,0,0,0,0,0,0,0,0,0,0,0,0.11905
660,This time a direct-hit would have seen the end of Shehzad despite a dive.,178,9,6,50.2253669188,0.00991925339895,0.073546013149,0.0,0.12134840852,0,0,0,0,0,0,0,0,0,0,0,0,0,0,0,0,0,0,0.10811
661,Crazy .,177,2,0,7.04025471128,0.0,0.0,0.0,0.0,0,0,0,0,0,0,0,0,0,0,0,0,0,0,0,0,0,0,0.0
662,"Taskin Ahmed to Hafeez, 1 run, Hafeez has put in a brilliant dive and that saves him.",176,13,7,60.5652753181,0.0,0.12134840852,0.0121356244114,0.0246577824521,0,0,0,0,0,0,0,0,0,0,0,0,0,0,0,0,0,0,0.11628
663,We are going upstairs to check though.,175,5,3,35.2870180632,0.0121356244114,0.0,0.0,0.0102698718338,0,0,0,0,0,0,0,0,0,0,0,0,0,0,0,0,0,0,0.064515
664,What worked in his favour was the head-start he had after coming down the track.,174,6,10,60.8176278149,0.0,0.0246577824521,0.0447715714089,0.0610966973189,0,0,0,0,0,0,0,0,0,0,0,0,0,0,0,0,0,0,0.159775
665,Then tries to go through with an aggressive flat-batted thump despite the bowler pulling his length back.,173,11,7,70.5288838379,0.0447715714089,0.0102698718338,0.00750256170991,0.0,0,0,0,0,0,0,0,0,0,0,0,0,0,0,0,0,0,0,0.13668
666,Chops it in front of mid-off where the fielder runs forward and rifles in a direct-hit.,172,9,8,53.9506577984,0.00750256170991,0.0610966973189,0.0,0.0,0,0,0,0,0,0,0,0,0,0,0,0,0,0,0,0,0,0,0.142855
667,Well home!,171,3,0,10.7572735824,0.0,0.0,0.0,0.0,0,0,0,0,0,0,0,0,0,0,0,0,0,0,0,0,0,0,0.04762
668,.,170,1,0,0.0,0.0,0.0,0.0,0.0,0,0,0,0,0,0,0,0,0,0,0,0,0,0,0,0,0,0,0.0
669,"Taskin Ahmed to Ahmed Shehzad, 1 run, taps a length ball in front of mid-off and is off for the single in a flash.",169,16,11,71.628971449,0.0,0.0,0.0185820167734,0.287299780055,0,0,0,0,0,0,0,0,0,0,0,0,0,0,0,0,0,0,0.163265
670,Hafeez reciprocates and it's completed easily .,168,6,2,27.997953887,0.0185820167734,0.0,0.0,0.0880321895608,0,0,0,0,0,0,0,0,0,0,0,0,0,0,0,0,0,0,0.060605
671,"Taskin Ahmed to Ahmed Shehzad, no run, tries to flat-bat the cut through the cover region.",167,13,6,51.5652255037,0.0,0.287299780055,0.108271011776,0.355221818814,0,0,0,0,0,0,0,0,0,0,0,0,0,0,0,0,0,0,0.1
672,"Shortish and wide outside off, and Shehzad chops it to the fielder .",166,8,6,41.0879193773,0.108271011776,0.0880321895608,0.159406875731,0.189725650798,0,1,0,0,0,0,0,0,0,0,0,0,0,0,0,0,0,0,0.13158
673,"Taskin Ahmed to Ahmed Shehzad, no run, stays rooted to the crease to a length ball, allows it to come in with the angle and blocks .",165,18,12,89.6455773042,0.159406875731,0.355221818814,0.378264888479,0.23314429471,0,0,0,0,0,0,0,0,0,0,0,0,0,0,0,0,0,0,0.153845
674,"Taskin Ahmed to Ahmed Shehzad, no run, back of a length just outside off, dabbed to backward point .",164,15,7,59.673345141,0.378264888479,0.189725650798,0.28245560152,0.0393159264879,0,1,0,0,0,0,0,0,0,0,0,0,0,0,0,0,0,0,0.1
675,"Taskin Ahmed to Ahmed Shehzad, FOUR, hops back and tucks it from middle stump and geez .. look at that running away.",163,18,7,86.1599539743,0.28245560152,0.23314429471,0.0793067666588,0.076513001623,0,0,0,0,0,0,0,0,0,1,0,0,0,0,0,0,0,0,0.106385
676,"Once it's on the practice pitches at mid-wicket, no stopping it.",162,7,7,42.2875897172,0.0793067666588,0.0393159264879,0.0,0.0,0,0,0,0,0,1,0,0,0,0,0,0,0,0,0,0,0,0,0.125005
677,Lightning quick outfield like alwaysTaskin Ahmed [ .,161,8,0,35.7676375713,0.0,0.076513001623,0.0,0.0,0,1,0,0,0,0,0,0,0,0,0,0,0,0,0,0,0,0,0.02857
678,- .,160,2,0,0.0,0.0,0.0,0.0,0.0,0,0,0,0,0,0,0,0,0,0,0,0,0,0,0,0,0,0,0.0
679,-0] is back into the attack .,159,5,3,17.0056488789,0.0,0.0,0.0,0.0517269461383,0,0,0,0,0,0,0,0,0,0,0,0,0,0,0,0,0,0,0.058825
680,"A Sunny to Hafeez, no run, fires it in immediately as a riposte to that six.",158,10,9,54.1182775758,0.0,0.0,0.111154832421,0.0,0,0,0,0,0,0,0,0,1,0,0,0,0,0,0,0,0,0,0.130345
681,Darted on middle and slides on with the angle rapidly to hit the pad of Hafeez as he tries to play across the line.,157,13,12,92.258599672,0.111154832421,0.0517269461383,0.0,0.0697700236567,0,0,0,0,0,0,0,0,0,0,0,0,0,0,0,0,0,0,0.167855
682,Would have gone down leg .,156,4,2,23.0562256127,0.0,0.0,0.0,0.0,0,0,0,0,0,0,0,0,0,0,0,0,0,0,0,0,0,0,0.058825
683,"A Sunny to Hafeez, SIX, one step, two steps, and bang!",155,13,3,45.0924479912,0.0,0.0697700236567,0.101016015892,0.0576420375246,0,0,0,0,0,0,0,0,1,0,0,0,0,0,0,0,0,0,0.10811
