,sentences,pos,len,len_stop,tfidf,sim_p,sim_pp,sim_n,sim_nn,century,out,bold,caught,stumped,wicket,hattrick,catch,six,four,amazing,hundred,ton,boundary,drop,toss,won,lost,score
553,"Raina to Corey Anderson, no run, this one stayed low and Corey Anderson chopped it to the left of MS, sends Santner back.",405,19,8,86.0385338743,0.0,0.0,0.0,0.202261651358,0,0,0,0,0,0,0,0,0,0,0,0,0,0,0,0,0,0,0.12796
554,Sensible call that .,404,3,1,16.0272685906,0.0,0.0,0.0,0.0470930534912,0,0,0,0,0,0,0,0,0,0,0,0,0,0,0,0,0,0,0.019605
555,"Raina to Santner, 1 run, Santner uses his feet and drives to long-off .",403,12,4,40.5197337433,0.0,0.202261651358,0.228104291117,0.271083482079,0,0,0,0,0,0,0,0,0,0,0,0,0,0,0,0,0,0,0.12
556,"Raina to Corey Anderson, 1 run, Corey Anderson backs away and biffs that straight to the fielder at long-off .",402,16,6,62.5743781127,0.228104291117,0.0470930534912,0.128430833697,0.123394775175,0,0,0,0,0,0,0,0,0,0,0,0,0,0,0,0,0,0,0.131705
557,"Raina to Santner, 1 run, down leg, flicked to deep mid-wicket, only a single .",401,14,5,41.380708656,0.128430833697,0.271083482079,0.278648635866,0.174606941274,0,0,0,0,0,1,0,0,0,0,0,0,0,0,0,0,0,0,0.09091
558,"Raina to Santner, no run, Santner comes down the track and yorks himself, jams it back to the bowler .",400,14,9,71.955060601,0.278648635866,0.123394775175,0.091441474769,0.0832574783638,0,0,0,0,0,0,0,0,0,0,0,0,0,0,0,0,0,0,0.15083
559,"Ravindra Jadeja to Corey Anderson, 2 runs, Corey Anderson shuffles across and gets outside off, the ball is down leg and as a full toss, gently clipped to fine leg for two more .",399,26,12,122.026383624,0.091441474769,0.174606941274,0.407550017288,0.30617615993,0,1,0,0,0,0,0,0,0,0,0,0,0,0,0,1,0,0,0.137255
560,"Ravindra Jadeja to Corey Anderson, wide, another ball down leg, poor bowling .",398,14,2,49.6963116401,0.407550017288,0.0832574783638,0.359626866814,0.0,0,0,0,0,0,0,0,0,0,0,0,0,0,0,0,0,0,0,0.099
561,"Ravindra Jadeja to Corey Anderson, no run, ooh!",397,9,2,29.6217442895,0.359626866814,0.30617615993,0.0,0.209065538518,0,0,0,0,0,0,0,0,0,0,0,0,0,0,0,0,0,0,0.11408
562,That was close.,396,2,2,12.2545076525,0.0,0.0,0.0,0.0,0,0,0,0,0,0,0,0,0,0,0,0,0,0,0,0,0,0,0.05963
563,"Ravindra Jadeja is coming from round the wicket to Corey Anderson and darting it in, beats the pull and not far from the off stump and also the bottom edge of the bat.",395,18,17,122.329927852,0.0,0.209065538518,0.0573904998675,0.138031365253,0,0,0,0,0,1,0,0,0,0,0,0,0,0,0,0,0,0,0.135805
564,MS fumbles the take .,394,4,1,18.1584189353,0.0573904998675,0.0,0.014310972989,0.0159673361583,0,0,0,0,0,0,0,0,0,0,0,0,0,0,0,0,0,0,0.083335
565,"Ravindra Jadeja to Santner, leg byes, 1 run, sharply turning in, Santner misses the flick and turning down.",393,18,5,69.9124119551,0.014310972989,0.138031365253,0.0992402422076,0.225614606436,0,0,0,0,0,0,0,0,0,0,0,0,0,0,0,0,0,0,0.11111
566,Another appeal for lbw but that was not even hitting the 5th stump down leg .,392,9,7,67.2964525505,0.0992402422076,0.0159673361583,0.0,0.0,0,0,0,0,0,0,0,0,0,0,0,0,0,0,0,0,0,0,0.128025
567,"Ravindra Jadeja to Santner, no run, tossed up on off, Santner gets forward and wrists it to short mid-wicketSlight delay in play and time to rest my fingers.",391,20,12,108.354839064,0.0,0.225614606436,0.0,0.0,0,0,0,0,0,1,0,0,0,0,0,0,0,0,0,1,0,0,0.114285
568,Phew!,390,2,0,7.1737861039,0.0,0.0,0.0,0.0,0,0,0,0,0,0,0,0,0,0,0,0,0,0,0,0,0,0,0.0
569,The action has been hectic.,389,3,3,23.1904434811,0.0,0.0,0.0,0.0139172973938,0,0,0,0,0,0,0,0,0,0,0,0,0,0,0,0,0,0,0.10345
570,Doesn't take too long for play to restart .,388,6,4,37.103703256,0.0,0.0,0.0121702214588,0.0,0,0,0,0,0,0,0,0,0,0,0,0,0,0,0,0,0,0,0.074075
571,"Ravindra Jadeja to Corey Anderson, 2 wides, now MS is in pain and flings the glove off.",387,13,7,66.9769882371,0.0121702214588,0.0139172973938,0.0670922188245,0.316090458647,0,0,0,0,0,0,0,0,0,0,0,0,0,0,0,0,0,0,0.12121
572,The physio is out there.,386,2,4,19.3063855176,0.0670922188245,0.0,0.0726287676596,0.0240348767624,0,1,0,0,0,0,0,0,0,0,0,0,0,0,0,0,0,0,0.105265
573,"It was again fired down leg and Corey Anderson missed the sweep, hits MS on the right thumb and he is in pain.",385,13,12,92.1506924435,0.0726287676596,0.316090458647,0.0218970384943,0.14540418837,0,0,0,0,0,0,0,0,0,0,0,0,0,0,0,0,0,0,0.12796
574,Another two runs added to the total .,384,6,2,30.3346807519,0.0218970384943,0.0240348767624,0.0455890718,0.0284473427454,0,0,0,0,0,0,0,0,0,0,0,0,0,0,0,0,0,0,0.12
575,"Ravindra Jadeja to Corey Anderson, wide, MS appealed for a caught behind to try and put the umpire off after Ravindra Jadeja came round the wicket and darted one outside leg, looked to have caught the pad, but given as wide .",383,31,15,165.156198193,0.0455890718,0.14540418837,0.324991572537,0.0494595884706,0,1,0,1,0,1,0,0,0,0,0,0,0,0,0,0,0,0,0.13737
576,"Ravindra Jadeja to Santner, leg byes, 1 run, now both MS and Ravindra Jadeja are appealing for lbw after Santner came down the track to flick and missed, may have struck him outside the line and may have been going down too.",382,28,19,174.425727944,0.324991572537,0.0284473427454,0.046293787405,0.323378801607,0,1,0,0,0,0,0,0,0,0,0,0,0,0,0,0,0,0,0.10032
577,They take a leg-bye .,381,3,2,9.46477028522,0.046293787405,0.0494595884706,0.0,0.0,0,0,0,0,0,0,0,0,0,0,0,0,0,0,0,0,0,0,0.109655
578,"Ravindra Jadeja to Santner, byes, FOUR, woohoo!",380,10,1,31.5934502809,0.0,0.323378801607,0.0597667186263,0.0,0,0,0,0,0,0,0,0,0,1,0,0,0,0,0,0,0,0,0.08
579,"That spun and bounced, from over the wicket, beat Santner all ends up and does the same to MS as well.",379,11,13,85.7662021173,0.0597667186263,0.0,0.129743837031,0.0183600880179,0,0,0,0,0,1,0,0,0,0,0,0,0,0,0,0,0,0,0.128205
580,Runs away over the stumps and just about shaves the bails .,378,6,6,46.7161434995,0.129743837031,0.0,0.0,0.0378284598997,0,1,0,0,0,0,0,0,0,0,0,0,0,0,0,0,0,0,0.157895
581,"Raina to Corey Anderson, no run, punched powerfully but finds cover to perfection .",377,12,4,53.2323626361,0.0,0.0183600880179,0.124570063329,0.218504068979,0,0,0,0,0,0,0,0,0,0,0,0,0,0,0,0,0,0,0.127085
582,"Raina to Santner, 1 run, Santner gets forward and takes it on the full, eased to long-on .",376,15,6,52.8890789376,0.124570063329,0.0378284598997,0.220154845384,0.146700974053,0,0,0,0,0,0,0,0,0,0,0,0,0,0,0,0,0,0,0.114285
583,"Raina to Corey Anderson, 1 run, flicked to deep backward square legMitchell Santner, left handed bat, comes to the crease .",375,21,4,72.2314961598,0.220154845384,0.218504068979,0.267811627662,0.121513323798,0,0,0,0,0,0,0,0,0,0,0,0,0,0,0,0,0,0,0.116155
584,"Raina to Corey Anderson, out Ross Taylor Run Out!!",374,9,3,30.2450984514,0.267811627662,0.146700974053,0.147534029007,0.0285583299076,0,1,0,0,0,0,0,0,0,0,0,0,0,0,0,0,0,0,0.11111
585,This wicket is all due to Raina.,373,4,4,28.1093372443,0.147534029007,0.121513323798,0.0284152354031,0.0109292033808,0,0,0,0,0,1,0,0,0,0,0,0,0,0,0,0,0,0,0.055555
586,Full credit to him.,372,3,2,17.3775041738,0.0284152354031,0.0285583299076,0.10025071994,0.0210506377477,0,0,0,0,0,0,0,0,0,0,0,0,0,0,0,0,0,0,0.05
587,"Firstly he anticipated the shot to his left, dived full-length, got hold of the ball and then threw down the stumps catching Ross Taylor short.",371,18,10,105.261102065,0.10025071994,0.0109292033808,0.142262504336,0.0,0,0,0,0,0,0,0,1,0,0,0,0,0,0,0,0,0,0,0.13745
588,Ross Taylor was backing up and didn't have the time to dive back in.,370,8,8,54.2178919593,0.142262504336,0.0210506377477,0.0,0.104481408731,0,0,0,0,0,0,0,0,0,0,0,0,0,0,0,0,0,0,0.151515
589,Only that could've saved him.,369,4,3,23.6510083576,0.0,0.0,0.0,0.0,0,0,0,0,0,0,0,0,0,0,0,0,0,0,0,0,0,0,0.074075
590,Instead he tries to plonk the bat in and it is in the air when the stumps are broken.,368,8,12,73.7367429316,0.0,0.104481408731,0.0,0.0619580856631,0,0,0,0,0,0,0,0,0,0,0,0,0,0,0,0,0,0,0.163705
591,Exceptional athletic abilitly from Raina.,367,5,1,28.2964275345,0.0,0.0,0.0,0.0,0,0,0,0,0,0,0,0,0,0,0,0,0,0,0,0,0,0,0.0625
592,Replays show that he threw the ball with his left-hand while off balance.,366,7,7,54.2988290388,0.0,0.0619580856631,0.0,0.0,0,0,0,0,0,0,0,0,0,0,0,0,0,0,0,0,0,0,0.125
593,And hit bulls-eye.,365,3,1,6.54270901636,0.0,0.0,0.0,0.0,0,0,0,0,0,0,0,0,0,0,0,0,0,0,0,0,0,0,0.1
594,Bingo.,364,2,0,7.1737861039,0.0,0.0,0.0,0.0,0,0,0,0,0,0,0,0,0,0,0,0,0,0,0,0,0,0,0.0
595,Once he sees the OUT flash on the big screen he celebrates.,363,6,7,54.7578814185,0.0,0.0,0.028092802288,0.0687164021558,0,1,0,0,0,0,0,0,0,0,0,0,0,0,0,0,0,0,0.115385
596,Ross Taylor was already a couple of steps out when Corey Anderson hit that and had no chance of getting back.,362,12,10,85.5735158877,0.028092802288,0.0,0.278498706408,0.212636625947,0,1,0,0,0,0,0,0,0,0,0,0,0,0,0,0,0,0,0.128205
597,Ross Taylor run out (Raina)  .,361,7,1,18.4208337545,0.278498706408,0.0687164021558,0.323177823611,0.49018838924,0,1,0,0,0,0,0,0,0,0,0,0,0,0,0,0,0,0,0.0677
598,"4) [4s-1]Raina to Corey Anderson, THAT'S OUT!!",360,12,3,18.7524563219,0.323177823611,0.212636625947,0.26077026073,0.0857354467989,0,1,0,0,0,0,0,0,0,0,0,0,0,0,0,0,0,0,0.14286
599,Run Out!,359,2,1,5.7712614119,0.26077026073,0.49018838924,0.328777700949,0.0,0,1,0,0,0,0,0,0,0,0,0,0,0,0,0,0,0,0,0.0625
600,!Third umpire called for a run-out check.,358,7,2,25.6960123817,0.328777700949,0.0857354467989,0.0,0.152406749159,0,1,0,0,0,0,0,0,0,0,0,0,0,0,0,0,0,0,0.115385
601,Has Raina done brilliantly?,357,4,1,21.1288334008,0.0,0.0,0.0,0.0,0,0,0,0,0,0,0,0,0,0,0,0,0,0,0,0,0,0,0.066665
602,to get Ross Taylor run out?,356,5,2,20.7761881209,0.0,0.152406749159,0.0,0.0291067394845,0,1,0,0,0,0,0,0,0,0,0,0,0,0,0,0,0,0,0.111115
603,Very close call.,355,3,1,16.7132472817,0.0,0.0,0.0,0.0,0,0,0,0,0,0,0,0,0,0,0,0,0,0,0,0,0,0,0.09091
604,Marais Erasmus is the third umpire and he wants to see the zoomer to check whether the bat is in the air or not.,354,12,13,98.9646361263,0.0,0.0291067394845,0.0,0.340429029586,0,0,0,0,0,0,0,0,0,0,0,0,0,0,0,0,0,0,0.144045
605,Looks out.,353,2,1,8.46008025108,0.0,0.0,0.0,0.107050726013,0,1,0,0,0,0,0,0,0,0,0,0,0,0,0,0,0,0,0.125
606,Ross Taylor's bat is in the air.,352,6,3,25.2965806958,0.0,0.340429029586,0.0739547748929,0.0,0,0,0,0,0,0,0,0,0,0,0,0,0,0,0,0,0,0,0.19643
607,"""My decision is out"" says Erasmus and the crowd roar.",351,8,5,46.6360627065,0.0739547748929,0.107050726013,0.0,0.0567665479921,0,1,0,0,0,0,0,0,0,0,0,0,0,0,0,0,0,0,0.15111
608,.,350,1,0,0.0,0.0,0.0,0.0,0.0,0,0,0,0,0,0,0,0,0,0,0,0,0,0,0,0,0,0,0.0
609,"Raina to Ross Taylor, 1 run, even Raina is turning the ball big, Ross Taylor makes room and has to adjust for the turn back in, gently pushes to cover and takes the singleSmart move by MS to bring on Raina and get in a couple of overs.",349,34,19,185.590325262,0.0,0.0567665479921,0.191549359091,0.0402499453007,0,0,0,0,0,0,0,0,0,0,0,0,0,0,0,0,0,0,0.141365
610,He can get through his overs in a flash and rarely gives the batsmen time to get their eye in.,348,10,11,83.5444107698,0.191549359091,0.0,0.0775303833821,0.0,0,0,0,0,0,0,0,0,0,0,0,0,0,0,0,0,0,0,0.18567
611,"If he gets a wicket then it is a bonus, today he got more than that when he dismissed the one man who could've taken New Zealand to a score of around  .",347,17,18,131.85715715,0.0775303833821,0.0402499453007,0.0,0.00644903640329,0,0,0,0,0,1,0,0,0,0,0,0,0,0,0,0,0,0,0.180885
612,.,346,1,0,0.0,0.0,0.0,0.0,0.0,0,0,0,0,0,0,0,0,0,0,0,0,0,0,0,0,0,0,0.0
613,So everything working in India's favor at the moment now .,345,7,5,47.6068173319,0.0,0.00644903640329,0.00855769701342,0.0,0,0,0,0,0,0,0,0,0,0,0,0,0,0,0,0,0,0,0.13668
614,"Raina to Corey Anderson, 1 run, shortish on the stumps, Corey Anderson backs away and thumps it to sweeper coverSuresh Raina [ .",344,20,6,76.9713816406,0.00855769701342,0.0,0.0,0.0167106652784,0,0,0,0,0,0,0,0,0,0,0,0,0,0,0,0,0,0,0.105265
615,- .,343,2,0,0.0,0.0,0.0,0.0,0.0,0,0,0,0,0,0,0,0,0,0,0,0,0,0,0,0,0,0,0.0
616,-1] is back into the attack .,342,5,3,17.3649931868,0.0,0.0167106652784,0.0,0.0,0,0,0,0,0,0,0,0,0,0,0,0,0,0,0,0,0,0,0.128785
617,"Ravindra Jadeja to Ross Taylor, no run, floated up on middle, Ross Taylor gets forward and defends .",341,16,5,68.787912096,0.0,0.0,0.231475329147,0.079576719538,0,0,0,0,0,0,0,0,0,0,0,0,0,0,0,0,0,0,0.105265
618,"Ravindra Jadeja to Corey Anderson, 1 run, Corey Anderson gets lucky.",340,13,1,37.5529252789,0.231475329147,0.0,0.0799743439939,0.0,0,0,0,0,0,0,0,0,0,0,0,0,0,0,0,0,0,0,0.10238
619,"For the umpteenth time, he charges and is beaten by the length, swipes and gets a thick inside edge to short fine.",339,15,10,88.5609658312,0.0799743439939,0.079576719538,0.157043590403,0.0495632014205,0,0,0,0,0,0,0,0,0,0,0,0,0,0,0,0,0,0,0.125
620,"If not for the inside edge, Mahendra Singh Dhoni would've been in business.",338,10,6,58.41146306,0.157043590403,0.0,0.0479038954529,0.00767866800004,0,0,0,0,0,0,0,0,0,0,0,0,0,0,0,0,0,0,0.19167
621,Hands on heads moment for the Indians .,337,5,3,33.5859361993,0.0479038954529,0.0495632014205,0.00983394786599,0.054056614115,0,0,0,0,0,0,0,0,0,0,0,0,0,0,0,0,0,0,0.13126
622,"Ravindra Jadeja to Ross Taylor, 1 run, fraction short outside off, Ross Taylor rocks back and slaps it square of the wicket .",336,20,6,81.857916597,0.00983394786599,0.00767866800004,0.206285970501,0.26833012977,0,1,0,0,0,1,0,0,0,0,0,0,0,0,0,0,0,0,0.126315
623,"Ravindra Jadeja to Corey Anderson, 1 run, on the pads, whipped to deep mid-wicket .",335,14,4,42.3879636764,0.206285970501,0.054056614115,0.213895246396,0.230730309573,0,0,0,0,0,1,0,0,0,0,0,0,0,0,0,0,0,0,0.09091
624,"Ravindra Jadeja to Ross Taylor, 1 run, uses his feet and the ball stops on his stroke, the thick leading edge runs through the vacant silly mid-off region .",334,23,9,111.680790805,0.213895246396,0.26833012977,0.234846641189,0.112107170489,0,0,0,0,0,0,0,0,0,0,0,0,0,0,0,0,0,0,0.12899
625,"Ravindra Jadeja to Ross Taylor, no run, did that pitch outside leg?",333,11,4,45.795346127,0.234846641189,0.230730309573,0.250102579271,0.0,0,1,0,0,0,0,0,0,0,0,0,0,0,0,0,0,0,0,0.07769
626,Only that could've saved Ross Taylor there.,332,6,3,32.1329981697,0.250102579271,0.112107170489,0.0,0.0,0,0,0,0,0,0,0,0,0,0,0,0,0,0,0,0,0,0,0.068965
627,Dhoni wasn't interested at all.,331,4,3,22.6572206187,0.0,0.0,0.0,0.0,0,0,0,0,0,0,0,0,0,0,0,0,0,0,0,0,0,0,0.042555
628,He was busy saving the run.,330,4,3,25.2616520266,0.0,0.0,0.0110901723882,0.0,0,0,0,0,0,0,0,0,0,0,0,0,0,0,0,0,0,0,0.125
629,"Only Ravindra Jadeja appealed there, pitched outside leg, turned across Ross Taylor's defensive stroke and struck him on the back leg.",329,19,6,94.5393454637,0.0110901723882,0.0,0.144785951262,0.049766908531,0,1,0,0,0,0,0,0,0,0,0,0,0,0,0,0,0,0,0.08118
630,"Once it pitches outside leg, can't be given out.",328,8,4,36.0844749204,0.144785951262,0.0,0.0,0.0476636298989,0,1,0,0,0,0,0,0,0,0,0,0,0,0,0,0,0,0,0.074075
631,"Dharmasena got that rightRavindra Jadeja, left-arm orthodox, comes into the attack .",327,11,3,46.9468272852,0.0,0.049766908531,0.00684822063187,0.0,0,0,0,0,0,0,0,0,0,0,0,0,0,0,0,0,0,0,0.10238
632,"Ashwin to Corey Anderson, no run, tossed up on leg, Corey Anderson's bat face closes and the thick leading edge rolls to backward point, no chance of a quick single .",326,26,10,116.12946071,0.00684822063187,0.0476636298989,0.188857529105,0.0470172044797,0,0,0,0,0,0,0,0,0,0,0,0,0,0,0,1,0,0,0.125395
633,"Ashwin to Ross Taylor, 1 run, tossed up and turns in, Ross Taylor stays back and plays a late dab, wide of MS and an easy single .",325,23,9,105.717622127,0.188857529105,0.0,0.400610274341,0.168772195477,0,0,0,0,0,0,0,0,0,0,0,0,0,0,0,1,0,0,0.10294
634,"Ashwin to Ross Taylor, FOUR, beautifully played by Ross Taylor.",324,11,2,44.2826205634,0.400610274341,0.0470172044797,0.185999121414,0.0,0,0,0,0,0,0,0,0,0,1,0,0,0,0,0,0,0,0,0.080835
635,"Picked the carrom ball, it goes straight on, Ross Taylor went back and then deftly opened the bat face to guide it through the vacant slip.",323,19,10,113.558705032,0.185999121414,0.168772195477,0.0512916517282,0.168456974923,0,0,0,0,0,0,0,0,0,0,0,0,0,0,0,0,0,0,0.160835
636,Wide of Bumrah at short third who was running in slow motion and the ball was always winning there .,322,11,9,83.1385691426,0.0512916517282,0.0,0.072797743781,0.0443991380542,0,0,0,0,0,0,0,0,0,0,0,0,0,0,0,0,0,0,0.10811
637,"Ashwin to Ross Taylor, no run, flat and on middle and leg, Ross Taylor shuffles across and misses the flick, an appeal from Ashwin for lbw but that was going down.",321,22,14,122.205259655,0.072797743781,0.168456974923,0.176681998153,0.352447083573,0,0,0,0,0,0,0,0,0,0,0,0,0,0,0,0,0,0,0.152555
638,Corey Anderson sends Ross Taylor back as the ball rolled close to Mahendra Singh Dhoni .,320,13,3,64.7477960664,0.176681998153,0.0443991380542,0.204221658806,0.143112333037,0,0,0,0,0,0,0,0,0,0,0,0,0,0,0,0,0,0,0.216035
639,"Ashwin to Ross Taylor, no run, lovely loop and flight outside off, dips on Ross Taylor, who was looking for the big cover drive, the dip takes the inside half of the bat and rolls back to the bowler .",319,29,16,154.353245869,0.204221658806,0.352447083573,0.102076747781,0.0,0,1,0,0,0,0,0,0,0,0,0,0,0,0,0,0,0,0,0.15032
640,"Ashwin to Corey Anderson, 1 run, floated up and Corey Anderson gets forward to wrist it through mid-wicket for a singleRavichandran Ashwin [ .",318,18,8,73.0718133823,0.102076747781,0.143112333037,0.0,0.0,0,0,0,0,0,1,0,0,0,0,0,0,0,0,0,0,0,0,0.146145
641,- .,317,2,0,0.0,0.0,0.0,0.0,0.0,0,0,0,0,0,0,0,0,0,0,0,0,0,0,0,0,0,0,0.0
642,. ],316,2,0,0.0,0.0,0.0,0.0,0.0,0,0,0,0,0,0,0,0,0,0,0,0,0,0,0,0,0,0,0.0
643,is back into the attack .,315,3,3,17.3649931868,0.0,0.0,0.0176494119426,0.0434904820401,0,0,0,0,0,0,0,0,0,0,0,0,0,0,0,0,0,0,0.13457
644,"Raina to Corey Anderson, 1 run, darted in on the stumps, Corey Anderson short-arm jabs a pull to deep mid-wicket .",314,18,6,59.5479099614,0.0176494119426,0.0,0.343385141855,0.378284113367,0,0,0,0,0,1,0,0,0,0,0,0,0,0,0,0,0,0,0.125
645,"Raina to Corey Anderson, no run, shortish on the stumps, Corey Anderson backs away and thumps the shot to cover, a good stop made as the ball was hit very hard .",313,24,12,115.565137351,0.343385141855,0.0434904820401,0.251649730236,0.102564359751,0,0,0,0,0,0,0,0,0,0,0,0,0,0,0,0,0,0,0.152555
646,"Raina to Corey Anderson, 2 runs, on the pads, flicked powerfully to deep mid-wicket, to the right of the fielder and another two .",312,19,9,75.5309357093,0.251649730236,0.378284113367,0.179340493593,0.379211287385,0,0,0,0,0,1,0,0,0,0,0,0,0,0,0,0,0,0,0.154335
647,"Raina to Ross Taylor, 1 run, turning in on middle and leg, tucked to deep backward square leg, for a single .",311,19,7,73.9800194616,0.179340493593,0.102564359751,0.186210051263,0.350386406194,0,0,0,0,0,0,0,0,0,0,0,0,0,0,0,0,0,0,0.128205
648,"Raina to Corey Anderson, 1 run, again Raina pulls the length back on seeing Corey Anderson advance, off the thick inside half and down to deep mid-wicket .",310,22,9,96.8462221152,0.186210051263,0.379211287385,0.243090762569,0.0538576712015,0,0,0,0,0,1,0,0,0,0,0,0,0,0,0,0,0,0,0.134365
649,"Raina to Corey Anderson, 2 runs, tucked off the pads to deep square leg, in the gap and an easy twoThis isn't an easy pitch to bat on.",309,21,12,108.29538751,0.243090762569,0.350386406194,0.0657753232509,0.0341758528625,0,0,0,0,0,0,0,0,0,0,0,0,0,0,0,0,0,0,0.14754
650,"The ball is stopping and definitely spinners will have a big role to play on this, provided there is now dew in the second innings.",308,13,14,104.329771893,0.0657753232509,0.0538576712015,0.130012524305,0.0,0,0,0,0,0,0,0,0,0,0,0,0,0,0,0,0,0,0,0.15977
651,"New Zealand have done the right thing by playing three spinners, but they have been too cavalier in their batting effort so far and that means they have to readjust their target.",307,17,17,146.660888661,0.130012524305,0.0341758528625,0.0,0.0,0,0,0,0,0,0,0,0,0,0,0,0,0,0,0,0,0,0,0.16554
652,A score of  .,306,2,2,9.08100353957,0.0,0.0,0.0,0.0,0,0,0,0,0,0,0,0,0,0,0,0,0,0,0,0,0,0,0.095235
653,looks certainly defendable on this .,305,4,2,24.856261727,0.0,0.0,0.035235650727,0.0651076649762,0,0,0,0,0,0,0,0,0,0,0,0,0,0,0,0,0,0,0.05263
654,"Bumrah to Corey Anderson, 1 run, pitched up outside off, Corey Anderson drills it on the rise and finds long-off .",304,17,7,67.2278892794,0.035235650727,0.0,0.229458543435,0.14228929737,0,1,0,0,0,0,0,0,0,0,0,0,0,0,0,0,0,0,0.135135
655,"Bumrah to Ross Taylor, 1 run, short of length and around off, Ross Taylor is on the walk as he pushes it to long-on .",303,17,11,79.88385994,0.229458543435,0.0651076649762,0.371628383817,0.457001453754,0,0,0,0,0,0,0,0,0,0,0,0,0,0,0,0,0,0,0.151685
656,"Bumrah to Ross Taylor, no run, angled in towards off, Ross Taylor's bat face closes and off the toe end of the bat, the thick bottom edge rolls towards cover .",302,26,10,123.611052184,0.371628383817,0.14228929737,0.362534482605,0.166547264218,0,0,0,0,0,0,0,0,0,0,0,0,0,0,0,0,0,0,0.153135
657,"Bumrah to Ross Taylor, no run, kept low and beats Ross Taylor's late cut.",301,15,3,60.0575269895,0.362534482605,0.457001453754,0.513596645762,0.0,0,0,0,0,0,0,0,0,0,0,0,0,0,0,0,0,0,0,0.109775
658,"Cut in as well, Ross Taylor wanted to play a late cut and it beat him.",300,11,7,64.3437494954,0.513596645762,0.166547264218,0.0,0.0374911052525,0,0,0,0,0,0,0,0,0,0,0,0,0,0,0,0,0,0,0.147645
659,Pacy delivery too .,299,3,1,15.8821143582,0.0,0.0,0.0,0.0,0,0,0,0,0,0,0,0,0,0,0,0,0,0,0,0,0,0,0.049995
660,"Bumrah to Corey Anderson, 1 run, shortish outside off, Corey Anderson chops it to sweeper cover .",298,16,4,56.6003488218,0.0,0.0374911052525,0.284906108821,0.290467288265,0,1,0,0,0,0,0,0,0,0,0,0,0,0,0,0,0,0,0.11602
661,"Bumrah to Corey Anderson, FOUR, off the toe end and still four.",297,11,4,47.5028042918,0.284906108821,0.0,0.171353738431,0.271241902301,0,0,0,0,0,0,0,0,0,1,0,0,0,0,0,0,0,0,0.142855
662,"The slower delivery outside off, Corey Anderson picked it but didn't time it off the middle of the bat.",296,12,10,68.8436429539,0.171353738431,0.290467288265,0.0740338447091,0.0,0,1,0,0,0,0,0,0,0,0,0,0,0,0,0,0,0,0,0.163705
663,Still good enough to beat mid-off to his left.,295,7,3,33.594291052,0.0740338447091,0.271241902301,0.07793215121,0.0854710627408,0,0,0,0,0,0,0,0,0,0,0,0,0,0,0,0,0,0,0.08333
664,Now all rests on this man if his side have to get a defendable total .,294,7,9,64.1000421545,0.07793215121,0.0,0.0560220067269,0.0621144631863,0,0,0,0,0,0,0,0,0,0,0,0,0,0,0,0,0,0,0.09091
665,"Raina to Ross Taylor, no run, immediately Dharmasena shakes his head.",293,11,3,50.4495403537,0.0560220067269,0.0854710627408,0.25988141663,0.0695422224041,0,0,0,0,0,0,0,0,0,0,0,0,0,0,0,0,0,0,0.10345
666,Ross Taylor shows the umpire his bat.,292,6,2,30.0164791475,0.25988141663,0.0621144631863,0.0,0.147563414701,0,0,0,0,0,0,0,0,0,0,0,0,0,0,0,0,0,0,0.08605
667,Too many things going against Raina and India there.,291,6,4,40.871461295,0.0,0.0695422224041,0.0235496637014,0.0,0,0,0,0,0,0,0,0,0,0,0,0,0,0,0,0,0,0,0.12
668,"Firstly Ross Taylor looked to have got an inside edge onto the pad on the paddle, and secondly he got outside the line of off and was playing a stroke.",290,18,14,122.431443565,0.0235496637014,0.147563414701,0.0682509179845,0.0129756321664,0,1,0,0,0,0,0,0,0,0,0,0,0,0,0,0,0,0,0.18016
669,"No way it could've been givenRoss Taylor, right handed bat, comes to the crease .",289,13,5,56.9702287821,0.0682509179845,0.0,0.0200432174442,0.0,0,0,0,0,0,0,0,0,0,0,0,0,0,0,0,0,0,0,0.102565
670,"Raina to Williamson, out Stumped!!",288,6,2,18.9295014867,0.0200432174442,0.0129756321664,0.200621630831,0.0,0,1,0,0,1,0,0,0,0,0,0,0,0,0,0,0,0,0,0.17805
671,That is poor from Williamson.,287,3,3,19.466172902,0.200621630831,0.0,0.0,0.140484049495,0,0,0,0,0,0,0,0,0,0,0,0,0,0,0,0,0,0,0.04545
672,He was the one batsman who should've batted through on this pitch.,286,6,8,53.1496224231,0.0,0.0,0.0188342399284,0.0190136184368,0,0,0,0,0,0,0,0,0,0,0,0,0,0,0,0,0,0,0.10811
673,"Gives Raina the charge, it is fired fuller and quicker outside off, beat the slash and MS is so quick behind the stumps, even though Williamson had no chance of coming back.",285,23,13,137.830021491,0.0188342399284,0.140484049495,0.137057791572,0.0,0,1,0,0,0,0,0,0,0,0,0,0,0,0,0,0,0,0,0.142855
674,Maybe the lure of attacking Raina got the better of Williamson there.,284,8,5,54.3273181657,0.137057791572,0.0190136184368,0.0,0.193815940492,0,0,0,0,0,0,0,0,0,0,0,0,0,0,0,0,0,0,0.172415
675,India well on top at Nagpur.,283,5,2,26.7755517439,0.0,0.0,0.0,0.0,0,0,0,0,0,0,0,0,0,0,0,0,0,0,0,0,0,0,0.07479
676,Williamson st Dhoni b Raina  .,282,6,0,18.2384616429,0.0,0.193815940492,0.366768357731,0.0,0,0,0,0,0,0,0,0,0,0,0,0,0,0,0,0,0,0,0.09091
677,"6) [4s-1]Raina to Williamson, THAT'S OUT!!",281,11,3,15.9409377027,0.366768357731,0.0,0.0,0.0,0,1,0,0,0,0,0,0,0,0,0,0,0,0,0,0,0,0,0.115385
678,Stumped!!,280,3,0,5.92102313541,0.0,0.0,0.0,0.0,0,0,0,0,1,0,0,0,0,0,0,0,0,0,0,0,0,0,0.05555
679,.,279,1,0,0.0,0.0,0.0,0.0,0.0,0,0,0,0,0,0,0,0,0,0,0,0,0,0,0,0,0,0,0.0
680,"Raina to Corey Anderson, 1 run, Raina is nearly through Corey Anderson there, shortened the length on seeing the batsman charge, Anderson swiped across the line and somehow got bat on that, the thick inside edge rolls to short mid-wicket.",278,33,13,154.767675353,0.0,0.0,0.0350909477253,0.418207447523,0,0,0,0,0,1,0,0,0,0,0,0,0,0,0,0,0,0,0.11236
681,MS sprints and prevents the possibilty of a second .,277,6,4,37.4710109453,0.0350909477253,0.0,0.0776603863338,0.0,0,0,0,0,0,0,0,0,0,0,0,0,0,0,0,0,0,0,0.148145
682,"Raina to Corey Anderson, no run, sliding down leg, on the pads, Corey Anderson fails to get bat on the flick, MS is there to prevent the leg-byeNow round the wicket to Corey Anderson .",276,26,14,118.899872155,0.0776603863338,0.418207447523,0.127993197427,0.158051095965,0,0,0,0,0,1,0,0,0,0,0,0,0,0,0,0,0,0,0.133125
683,"Raina to Williamson, 1 run, turning in, Williamson plays a half-sweep/half-pull to deep backward square leg .",275,16,4,50.56136976,0.127993197427,0.0,0.183577722409,0.0386593019052,0,0,0,0,0,0,0,0,0,0,0,0,0,0,0,0,0,0,0.10811
